article_text,article_title,date,link,publisher
"WASHINGTON (AP) — Podiums get sanitized before the candidate steps up to speak. Fist or elbow bumps take the place of handshakes, and kissing babies is out of the question. Rallies are canceled, leaving candidates speaking to a handful of journalists and staffers instead of cheering crowds of thousands. This is campaigning in the age of the coronavirus, when fears of the new pandemic’s rapid spread  are upending Joe Biden’s and Bernie Sanders’ campaigns. The urgency of the issue comes at a pivotal time in the Democratic presidential primary, as Biden is beginning to pull ahead as a front-runner for the nomination and as Sanders is scrambling to catch up.  “If coronavirus has the lasting impact that we all fear it will, it will also dramatically reshape the way a presidential campaign unfolds,” said Jesse Ferguson, a veteran Democratic strategist and former spokesman for Hillary Clinton’s campaign. “Politics is fundamentally about leaders interacting with the people who they represent, and if a pandemic forecloses that ability, it changes everything — how you campaign, how you knock doors, how you do events and how you do the retail part of politics.” While coronavirus concerns have been building as new cases crop up daily and as Democrats criticize President Donald Trump for what they consider a lackluster response, Tuesday marked the first moment the issue affected the campaigns in a substantive way. Both Biden and Sanders decided to cancel planned election-night rallies in Ohio at the advice of local health officials. And so Biden -- who won at least four of the six states voting Tuesday -- delivered a victory speech to a crowd almost entirely composed of media and dozens of staffers who had wandered over from headquarters. It was hardly the big celebration Biden had hoped for on one of the biggest nights of his 2020 campaign. It’s not the first time a major national crisis has upended the contours of a presidential race. During the 2008 campaign, as the economy was in free fall, Republican nominee John McCain returned to Washington to work on the congressional response to the crisis in an effort to revive his flagging campaign. Steve Schmidt, McCain’s top adviser, has said the coronavirus crisis could be particularly problematic for Sanders — and for Trump. “The raw politics of this is that it freezes the Democratic race in place for Bernie Sanders, who is on his last legs. You can’t have a revolution without rallies,” he said. Trump, meanwhile, delights in turning out tens of thousands of supporters to his events and has kept up a steady calendar of rallies in recent months. “The Trump show is sustained by rallies,” he said. While they have not said they are holding off on rallies, Trump’s campaign doesn’t have any on the schedule — a rare break to his persistent counterprogramming.  The campaign postponed a “Women for Trump” bus tour through Michigan, citing “scheduling conflicts,” after the husband of a participant came into contact with someone who tested positive for the virus at the Conservative Political Action Conference in Washington. Late Wednesday, the White House announced Trump would cancel his trips to Colorado and Nevada “out of an abundance of caution” amid the coronavirus outbreak. He was set to leave Thursday for a Western swing that would include a pair of fundraisers and an appearance at the annual gathering of the Republican Jewish Coalition in Las Vegas — just the kind of event that public health officials had been urging people to avoid. The 73-year-old president has also continued to shake hands and speak at large gatherings, despite public health warnings directed at people his age. For most people, the new coronavirus causes only mild or moderate symptoms, such as fever and cough. For some, especially older adults and people with existing health problems, it can cause more severe illness, including pneumonia. The vast majority of people recover from the new virus. According to the World Health Organization, people with mild illness recover in about two weeks, while those with more severe illness may take three to six weeks to recover. In mainland China, where the virus first exploded, more than 80,000 people have been diagnosed and more than 58,000 have so far recovered. While Trump continues his handshaking, those warnings from officials could affect the way Biden campaigns. While the former vice president typically holds smaller events and has only consistently turned out crowds in the thousands since winning South Carolina on Feb. 29, he’s known for his personal, often physical interactions with voters. He often doles out hugs or goes forehead-to-forehead with a voter to share an emotional moment. Rick Hasen, an election law expert and professor at the University of California’s Irvine School of Law, joked that Biden may have “some things to learn about social distancing.” Indeed, even Biden’s senior adviser Anita Dunn was trading elbow bumps instead of handshakes with a reporter on the trail this week. It’s not just rallies that face restrictions with the spread of the new coronavirus. The Democrats’ next debate, being held Sunday in Arizona, will not have a live audience at the request of both campaigns. One major concern for the candidates is turnout -- particularly among older voters, who make up a key portion of Biden’s base. “I certainly think that it has the potential to cause both voters and poll workers to want to stay away from places where people gather,” Hasen said. Election officials in Ohio and Chicago announced they’re moving polling centers out of senior centers and nursing homes, which could make it tougher for seniors to vote and create confusion for voters. Some Democratic operatives have expressed concerns that some states could see a shortage in volunteers on Election Day. Election officials in Florida, where early voting is underway, are sanitizing voting machines hourly with disinfectant wipes. Kelly Dietrich, CEO of the National Democratic Training Committee, a group that trains Democrats who want to run for office or work on a campaign, said they’re already seeing a decline in people who have registered to participate in their training over fear of showing up to large gatherings. “That fear is a prime motivator. It’s going to affect your campaign. It needs to be taken into account,” Dietrich added. The Sanders campaign held a call with staff and advisers to go over new organizing protocols on Wednesday. Signs of heightened concern could be seen on the Biden campaign trail earlier this week. His press aides offered liberal doses of hand sanitizer as his traveling press boarded their plane. And at a high-dollar fundraiser this week in Detroit, boxes of disinfectant wet wipes were placed on the cocktail tables. But even as the outbreak scrambles the campaigns’ operational plans, it offers Democrats an opportunity to draw a contrast with Trump on presidential leadership. “In a situation like this, coronavirus or a financial crisis, you see in real time how the candidates would react if they were president,” Schmidt said. Seeking to calm financial markets during an election year, Trump has repeatedly downplayed the threat posed by the virus, insisting that it will simply sort itself out. But his administration on Wednesday appeared to be coming to terms with the widespread impact as it considered more drastic measures. To that effect, Biden is giving an address Thursday outlining how he would address the outbreak as president. On Wednesday, he announced the formation of a “Public Health Advisory Committee,” comprised of five doctors and a former Obama counterterrorism adviser, that will “provide science-based, expert advice” to the campaign on ways it can minimize health risks. Sanders has argued that the outbreak underscores the need for “Medicare for All” to avoid steep hospital bills for people who contract — or think they may have contracted — the new coronavirus. “This crisis, this absurd health care system, is becoming more and more obvious to the American people as we face the challenge of a coronavirus pandemic,” he said Wednesday. “Imagine facing a pandemic and having 87 million people who are having a difficult time going to a doctor when they need.” ___ Associated Press writer Jill Colvin in Washington contributed to this report. ___ Catch up on the 2020 election campaign with AP experts on our weekly politics podcast, “Ground Game.” ___ The Associated Press receives support for health and science coverage from the Howard Hughes Medical Institute’s Department of Science Education. The AP is solely responsible for all content.","From handshakes to kissing babies, virus upends campaigning",2020-03-11T22:13:33Z,https://apnews.com/56e574e66c91a0c1c82569a4c6f9c7e9,AP
"WASHINGTON (AP) — There’s one thing the Trump administration wants Americans to remember about the coronavirus pandemic: It carries the “Made in China” label. Trump administration officials, on the defensive about their own handling of the virus, have repeatedly reminded people that the virus started in Wuhan, a city in China’s Hubei province, with Secretary of State Mike Pompeo referring to it as the “Wuhan coronavirus.” President Donald Trump’s national security adviser, Robert O’Brien, went even further on Wednesday.  “Unfortunately, rather than using best practices, this outbreak in Wuhan was covered up,” O’Brien said at the Heritage Foundation, a conservative-leaning think tank in Washington. “There’s lots of open-source reporting from China, from Chinese nationals, that the doctors involved were either silenced or put in isolation, or that sort of thing, so that the word of this virus could not get out. It probably cost the world community two months.” O’Brien said that if experts would have had those two months to get ahead of the spread of the virus, “I think we could have dramatically curtailed what happened both in China and what’s now happening across the world.”  O’Brien’s remarks seemed to be aimed at countering a disinformation campaign that Sen. Marco Rubio, R-Fla., says China’s Communist Party is waging to blame the U.S. for the virus so it can dampen discontent in China, distract from true infection rates and “save face internationally.” “The Chinese military portal Xilu.com recently published an article baselessly claiming that the virus is ‘a biochemical weapon produced by the U.S. to target China,’” Rubio wrote. China, however, says it is helping the international community battle the virus. U.N. Ambassador Zhang Jun told reporters at U.N. headquarters in New York that Beijing is working closely with other countries and have provided medical supplies to nations, including Korea, Japan and Italy.  “We are sending medical teams to countries that need that, and we will do whatever to join the international community to fight this virus ... because we have only one world, we need to join hands, we need to show solidarity.” Rubio claims that besides China, disinformation is coming from Russia and Iran, the hardest-hit country in the Middle East. “In Qom, ground zero of Iran’s coronavirus outbreak, a prominent cleric accused the United States of introducing the virus ‘to damage (the city’s) culture and honor,’” Rubio wrote.  While Trump has lauded Chinese President Xi Jinping’s work to respond to the virus, Trump himself has referred to “China’s Coronavirus situation.” Trump has been criticized for playing down the virus, contradicting his own public health officials and concentrating more on the economic fallout from the outbreak. In a speech to the nation Wednesday night he referred to the “foreign virus” that “started in China.” (He also worked in some digs at Europe for letting it spiral out of control there.) For most people, the new coronavirus causes only mild or moderate symptoms, such as fever and cough. For some, especially older adults and people with existing health problems, it can cause more severe illness, including pneumonia. The vast majority of people recover from the new virus. According to the World Health Organization, people with mild illness recover in about two weeks, while those with more severe illness may take three to six weeks to recover. In mainland China, where the virus first exploded, more than 80,000 people have been diagnosed and more than 58,000 have so far recovered. Health professionals, who depend on China for access to the country, have publicly praised Beijing for its response, noting that it is difficult to spot a new virus during flu season when there are numerous alerts about atypical pneumonia and other respiratory problems.  On Capitol Hill, Robert Redfield, director of the U.S. Centers for Disease Control and Prevention, praised China’s work to control the spread of coronavirus. “They really have now got control of their outbreak,” Redfield told the House Oversight and Reform Committee on Wednesday. Chinese health officials informed the WHO about the new virus on Dec. 31. By Jan. 8, it had been identified as a new coronavirus, a large family that causes the common cold and more serious illnesses including SARS, which also began in China. By Jan. 12, Chinese scientists had sequenced the virus’ genetic makeup and shared it with WHO, drawing praise for their transparency and swift action. O’Brien is right, however, in noting some missteps in China.  The local Wuhan heath commission reported no new cases from Jan. 5-10 and again from Jan. 12-16. China’s Lunar New Year rush — the world’s largest annual human migration — began to get underway, with millions of people passing through Wuhan, a major transit hub. A recently submitted complaint to the country’s National Health Commission alleged that during this period, officials with the Wuhan health commission told doctors they were not allowed to report about the new virus, letting patients wander around freely instead of being isolated. China’s foreign ministry has taken offense at people blaming China. After Pompeo called it the “Wuhan coronavirus,” the ministry’s spokesman said the description was “despicable,” disrespected science and stigmatized China.  Other Republicans also have specifically pointed how the outbreak was first reported in China. Rep. Paul Gosar, R-Ariz., a dentist who is self-quarantined after coming into contact with an infected individual, called it “Wuhan virus” and House Minority Leader Kevin McCarthy called it the “Chinese coronavirus.” On Thursday, leaders of the Asian Pacific American, Hispanic, Black and Native American congressional caucuses called on McCarthy and Gosar to apologize and noted that the CDC’s chief medical officer, Dr. Mitch Wolfe, has said, “Stigma is the enemy of public health.” ___ Associated Press writers Ricardo Alonso-Zaldivar in Washington and Edith Lederer at the United Nations contributed to this report. ___ The Associated Press receives support for health and science coverage from the Howard Hughes Medical Institute’s Department of Science Education. The AP is solely responsible for all content.",Trump officials emphasize that coronavirus 'Made in China',2020-03-12T04:24:37Z,https://apnews.com/5866bf32d5723402d2df32baa844fff3,AP
"WASHINGTON (AP) — President Donald Trump announced Wednesday night that he will instruct the Treasury Department to allow individuals and businesses negatively affected by the coronavirus to defer their tax payments beyond the April 15 filing deadline. In an address from the Oval Office, Trump said he would use his emergency authority to allow individual taxpayers ad businesses to defer paying their taxes by next month’s deadline if they have suffered adverse effects from the spreading virus. Treasury Secretary Steven Mnuchin told Congress earlier Wednesday that the payment delay would have the effect of putting more than $200 billion back into the economy that would otherwise go to paying taxes next month. He did not indicate what the new deadline would be. Mnuchin told reporters that the delay would cover “virtually all Americans other than the super-rich.” He said the delay would not apply to large corporations or very wealthy taxpayers but he did not offer any specific income or asset thresholds that would be needed to qualify for the delay. Mnuchin told a House Appropriations subcommittee that the administration could grant the tax delay without having to go to Congress for approval.  Mnuchin said the delay would allow individuals to not pay their taxes by the April 15 deadline. The IRS would also waive interest payments or other penalties for missing the deadline. Under current IRS rules, taxpayers can get an automatic extension on filing their tax returns but they are required to pay tax on the estimated amount they will owe when they do file. Members of Congress have urged the administration to take this step amid the coronavirus crisis. “Given the growing nationwide concerns regarding the potential spread and the resulting economic and public health impact of such an outbreak, we urge you to act quickly and remove one source of stress that individuals face during the crisis,” Sens. Bob Menendez, D-N.J., and Patty Murray, D-Wash., said in a letter to IRS Commissioner Charles Rettig. “The American people should not have to worry about filing IRS forms in the middle of a public health emergency,” the two senators wrote. In addition to using emergency authority to allow taxpayers who have been affected by the virus to defer their taxes, the president said, effective immediately, he would have the Small Business Administration start providing low-interest loans for businesses in states and U.S. territories that have been affected by the virus. He said these loans would help small businesses overcome the economic disruptions that have been caused by the virus. In addition, he said he would request that Congress boost this loan pool by providing an additional $50 billion in funding for the SBA. Trump said he would also take emergency action to provide financial relief to allow working Americans who have been affected by the virus to stay at home if they are ill, quarantined or taking care of others dealing with the coronavirus. He said he would ask Congress to provide additional funding for this worker relief.",Trump announces delay of tax deadline for virus victims,2020-03-12T03:53:58Z,https://apnews.com/95b0a0bcf0d27e7fa018951b122cf1ec,AP
"WASHINGTON (AP) — President Donald Trump incorrectly stated in his address to the nation that the health insurance industry has agreed to waive patient co-payments for treatment of COVID-19. The industry has not made such a commitment.  Instead, insurers agreed to cover the full cost of diagnostic tests to see whether people have the disease. That step does not shield insured people from potentially high medical bills as a result of getting sick from the coronavirus. Trump’s misstatement on health insurance was one of a number of claims in his prime-time address  that were at odds with the facts. He inaccurately described part of his own plan to restrict travel from Europe  and appeared to hold out false hope that people infected in the current outbreak will see new treatments to hasten their healing. A look at his remarks Wednesday night: TRUMP: “Earlier this week, I met with the leaders of (the) health insurance industry, who have agreed to waive all co-payments for coronavirus treatments, extend insurance coverage to these treatments, and to prevent surprise medical billing.” THE FACTS: No, they did not say they will cover co-pays for treatment. And Trump’s statement about surprise medical billing is questionable. As Vice President Mike Pence stated more accurately, the insurers agreed to cover coronavirus testing with no cost sharing — so no co-pays or deductibles. That assurance applies to tests that can confirm or rule out the virus, and doesn’t extend to treatment or to other tests that the patient’s doctor may order. Consumers should check with their insurance company because policies may vary on this. They should not count on the president’s word. What’s more, in the process of diagnosing COVID-19, other tests may be ordered. Insurers have not pledged to waive cost-sharing for those. Co-pays and deductibles may apply for imaging tests such as X-rays or CT scans of the chest, for example, and hospital stays are also subject to cost-sharing. Federal programs including Medicare, Medicaid, children’s health insurance and “Obamacare” all cover the coronavirus tests. Of particular importance, clinical diagnostic tests are covered under Medicare with no cost-sharing, a longstanding policy. However, cost-sharing may apply for other tests, such as imaging. When people get sick from the coronavirus, there currently is no antiviral treatment that can cure the disease. Instead, the current treatment is geared to relieving patients’ symptoms and helping them to recover. For those who are very sick, that can involve using machinery to help them breathe. Insurers cover such treatment based on the terms of the individual’s health plan, including any applicable deductibles and co-pays. As for “surprise billing,” that’s not something insurers can waive because they’re not the ones who do it. Doctors and hospitals generally spring those surprises. Overall, says Karen Pollitz of the nonpartisan Kaiser Family Foundation: “We don’t have a rule yet that says all insurers must do ‘x,’ so flip your insurance card over and call the 800 number.”  For most people, the new coronavirus causes only mild or moderate symptoms, such as fever and cough. For some, especially older adults and people with existing health problems, it can cause more severe illness, including pneumonia.  ___ TRUMP: “We are cutting massive amounts of red tape to make antiviral therapies available in record time. These treatments will significantly reduce the impact and reach of the virus.” THE FACTS: People suffering from COVID-19 or those who get it in the current outbreak should not expect those therapies to be available to them. Dr. Anthony Fauci of the National Institutes of Health told a congressional committee Wednesday that while antivirals are being tested, “we don’t know if it works. I don’t want to promise anything.” An antiviral is a medicine that specifically attacks a virus to hasten recovery. An experimental drug named remdesivir, which was being developed to fight Ebola, is being tested in COVID-19 patients in the U.S. and abroad. There also are studies underway using combinations of some HIV-attacking drugs. ___ TRUMP: “We will be suspending all travel from Europe, except the United Kingdom, for the next 30 days.” THE FACTS: That’s not exactly his plan.  First, the restriction does not apply to legal permanent residents of the U.S. or their families when they are returning from Europe. It also does not apply to U.S. citizens coming back from Europe, as Trump acknowledged. As well, it apparently does not apply to Ireland, Romania, Croatia, Ukraine and several other European states. The proclamation released by the White House says the travel ban will affect the 26 European states in what’s known as the Schengen Area. That’s most of Europe, but not “all.” ___ TRUMP: “These prohibitions will not only apply to the tremendous amount of trade and cargo, but various other things as we get approval.”  THE FACT: That is also wrong. The White House quickly clarified that the restriction on movement from Europe “only applies to human beings, not goods and cargo.” ___ EDITOR’S NOTE — A look at the veracity of claims by political figures. ___  Associated Press writers Jill Colvin, Lauran Neergaard, Zeke Miller and Tom Murphy contributed to this report. ___ Find AP Fact Checks at http://apne.ws/2kbx8bd  Follow @APFactCheck on Twitter: https://twitter.com/APFactCheck",AP FACT CHECK: Trump is wrong about insurers and coronavirus,2020-03-12T03:31:45Z,https://apnews.com/fb47f78357ea4a29c824dd36cc206e69,AP
