article_text,article_title,date,link,publisher
"WASHINGTON (AP) — A quirk in how delegates are won under Democratic Party rules is raising the stakes for Tuesday’s elections, allowing a candidate to make up ground in the race quickly — or fall further behind. Five states — Michigan, Washington, Missouri, Mississippi and Idaho — hold Democratic primaries on Tuesday, while North Dakota has a caucus. All told, there are 352 delegates up for grabs. A candidate needs 1,991 delegates to win the Democratic presidential nomination. That makes for only the fourth-largest delegate night on the primary calendar. But the intricate arithmetic of how delegates are won under Democrats’ rules makes it possible for a candidate to reap a bigger haul of delegates with a smaller margin of victory on this Tuesday than on any other night. For Bernie Sanders, it’s an opportunity to catch up to Joe Biden, who enters the day ahead by 96 delegates. For Biden, it’s a chance to open up what could become an insurmountable lead. How this happens may seem complicated, but it’s nothing more than some basic math and an “odd” quirk of how delegates are won under party rules. Most delegates awarded Tuesday — 65% — will be won based on how the candidates perform in individual congressional districts. Think of each district as holding a bucket of delegates. There are also two buckets of delegates in each state awarded based on the overall statewide vote. On Tuesday, that makes for 51 buckets of delegates across the six states. A candidate needs to win at least 15% of the overall vote in a bucket to be “viable” — or to qualify to win delegates. (That 15% threshold means it’s all but assured that only Biden and Sanders win any delegates from this point forward.) First, the math. Party rules say each viable candidate wins a proportion of the delegates in each bucket based on his share of the votes cast for the viable candidates in that bucket. Second, the quirk. Buckets that have an odd number of delegates are impossible to split evenly, meaning either Sanders or Biden is guaranteed to win at least one more than the other. Say, for example, there are seven delegates in a bucket, and Sanders gets 51% and Biden gets 49% of the viable votes. In delegates, that’s 3.57 to 3.43 — a difference of just 0.14 delegates. But thanks to rounding, Sanders gets four and Biden gets three. Nearly two-thirds of the 352 delegates at stake on Tuesday are in buckets with an odd number of delegates — more than on any other night with more than one primary. Democratic National Committee member Elaine Kamarck, who was Walter Mondale’s delegate hunter during his campaign for president in 1984, said it’s “odd” how the odd-even districts work out, but it all adds up to whoever does best on Tuesday waking up Wednesday with “a comfortable haul.” But wait: It gets better — or worse, if you’re the candidate who ends up behind. After the primaries on March 17, most of the delegates to be won come from buckets with an even number of delegates. Why does that matter? It means Biden or Sanders will need to win far more than 50% of the vote in a bucket to win more delegates than his rival. From a bucket holding six delegates, a candidate needs more than 58.3% to win four delegates. In a district with eight delegates, the leader needs 56.3% to get five. Put another way, a candidate could keep coming in second in the overall vote, but so long as he keeps the race relatively close, he’ll still end up with the same number of delegates in an “even” bucket as the candidate who finishes first. And that means whoever does best on Tuesday, and next week when Arizona, Florida, Ohio and Illinois get their turn, could end up with a delegate lead that can’t be beat. “It’s just funny how the numbers just work out,” Kamarck said Monday, and that means Tuesday night is “a big deal.” ___ Catch up on the 2020 election campaign with AP experts on our weekly politics podcast, “Ground Game.”",'Odd' quirk raises delegate stakes in Tuesday's elections,2020-03-10T04:15:12Z,https://apnews.com/8d90a37e5e5b177d08424fd14a24ffe6,AP
"DETROIT (AP) — Bernie Sanders proved his 2016 presidential bid was serious with an upset victory in Michigan powered by his opposition to free trade and appeal among working-class voters. Four years later, the same state could either revive the Vermont senator’s campaign or relegate him to the role of protest candidate. Michigan and five other states hold presidential contests on Tuesday at a critical point in the Democratic race.  Former Vice President Joe Biden is looking to quash Sanders’ hopes and cement his own front-runner status just a week after resurrecting his beleaguered White House bid with a delegate victory on Super Tuesday. He played up his underdog story on Monday as he campaigned across Michigan, reflecting on his stutter as a child and the deaths of his first wife and young daughter.  And Biden wasn’t alone. The former vice president courted the state’s influential African American voters alongside the two most prominent black candidates previously in the 2020 race, Kamala Harris and Cory Booker, who endorsed Biden in recent days as part of a broader consolidation of support among party leaders. Sanders is in an urgent fight to turn things around as the primary calendar quickly shifts to other states that could favor Biden and narrow his path to the nomination. The senator countered the parade of Democratic firepower lining up behind Biden by securing the endorsement of the Rev. Jesse Jackson and deploying Rep. Alexandria Ocasio-Cortez, D-N.Y., on his behalf. Having devoted several days to Michigan, the Vermont senator spent the eve of Tuesday’s primaries in Missouri, where he downplayed questions about electability and insisted that the “energy and excitement” of his supporters made him the strongest Democrat to run against President Donald Trump this fall.  Tuesday marks the first time voters will weigh in on the Democratic contest since it effectively narrowed to a two-person race between Sanders and Biden. It will be another test of whether Sanders can broaden his appeal among African Americans. Biden, meanwhile, must show that he can keep momentum going after his surprise Super Tuesday turnaround.  “I like his chances,” Michigan Gov. Gretchen Whitmer, who has endorsed Biden, said of the former vice president in an interview. “He knows Michigan,” Whitmer added. “When our back was up against the wall during the auto struggles of the past, it was Barack Obama and Joe Biden who had our backs.” That’s a reference to the Obama administration overseeing federal bailouts that helped the auto industry — the lifeblood of Michigan’s economy — weather the 2009 financial crisis. Sanders counters that he, too, voted to save the auto industry. He also says that, unlike Biden, he opposed the North American Free Trade Agreement, which he said prompted thousands of Michigan jobs to move to Mexico since taking effect in 1994. Biden ticked off the names of six former presidential rivals who have endorsed him just in the past week during a Monday appearance with Booker in Flint, Michigan, a community that has seen auto industry jobs disappear: “They’ve all come out and endorsed at one time ... the candidate that they think can win.” And later in Detroit, he stood on stage grasping hands with Whitmer, Booker and Harris, a powerful trio of potential vice presidential picks should Biden become the Democrats’ presidential nominee.  The large rally was interrupted repeatedly by protesters, however, who railed against Biden’s support for the North American Free Trade Agreement and his reluctance to embrace sweeping environmental proposals outlined in the so-called Green New Deal.  In a scuffle with environmental protesters in the midst of Biden’s remarks, senior adviser Symone Sanders was knocked to the ground. She was not hurt. Less than a week ago she tackled a protester who rushed the stage as Biden spoke in California. Other economic challenges emerged on Monday as fears about the spread of the new coronavirus shook financial markets, slicing 7.8% from the Dow Jones Industrial Average. Sanders held a roundtable with health experts in Detroit, and Biden said he would defer to health experts about whether campaign events could continue, given concerns about the spread of the virus. Anthony Fauci, the nation’s leading infectious disease expert, stopped short of calling on candidates to put a pause on political rallies. Instead, he said he wouldn’t criticize someone seeking office for putting a pause on big gatherings. “If you’re talking about a campaign rally tomorrow in a place where there is no community spread, I think the judgment to have it might be a good judgment,” Fauci said Monday at a White House briefing. “If you want to talk about large gatherings in a place where you have community spread, I think that’s a judgment call.” An outstanding question going into Tuesday is whether Massachusetts Sen. Elizabeth Warren, who dropped out of the race last week, will endorse Biden or Sanders. So far, she’s declined to back either, an especially frustrating development for Sanders, who could use Warren’s help in unifying progressives in much the same way Biden has been able to rally moderates. Sanders has scoffed at suggestions he could drop out if he doesn’t win Michigan, but his travel schedule underscores its importance. He canceled a trip to Mississippi and instead made five campaign stops across Michigan since Friday.  Sanders won’t say if he’s personally lobbying Warren for her endorsement. He did manage to secure the backing of Jackson, who said it was no time for centrist compromise.  He jabbed Biden during a Monday appearance in downtown St. Louis, reminding a largely young crowd of the former vice president’s long record in Washington. Sanders noted that unlike Biden, he opposed the war in Iraq, Wall Street bailouts after the 2008 collapse and any talk of cuts to Social Security. “In a general election, which candidate can generate the enthusiasm and the excitement and the voter turnout we need?” Sanders asked. “If you want to defeat Trump, which all Democrats do and the majority of independents do and some Republicans do, we are that campaign.”  One of Sanders’ highest-profile supporters, Ocasio-Cortez, struck a far more conciliatory tone the day before addressing 10,000-plus on the campus of the University of Michigan on Sunday night, saying, “In order for us to win, we have to grow.”  “We must be inclusive. We must bring more people into this movement,” she said, urging Sanders supporters to shed “cynicism and exclusion” and “turn with an embracing posture, where all people are welcome in a people’s movement.”  Sanders is optimistic about Washington state on Tuesday, but could face hurdles in Mississippi and Missouri. Sanders’ team acknowledges he will also struggle in next week’s Florida primary, where the senator’s past defense of Fidel Castro looms large. He also could face long odds in Ohio and Illinois — especially if he underperforms in Michigan. Both of those states also vote March 17. The wild card next week could be Arizona, where Sanders will be counting on strong Latino support, which lifted him to victory in California.  Sanders advisers are aware that Biden could build an insurmountable delegate lead if he runs up the score in the upcoming contests. They hope to continue doing well in the West before picking up momentum in places like delegate-rich New York, which holds its primary next month.  There’s no guarantee Sanders could last that long this time, however, given the higher expectations he now faces. Even some of those attending Sanders rallies are beginning to feel it, although his St. Louis audience was optimistic. Alec McAulay, a 19-year-old college student from St. Louis County, said Sanders has proved that he’s a true alternative to the president.  “I think Biden agrees with Trump too much, more than any Democrat should,” McAulay said.  ___ Associated Press writers Seth Borenstein in Washington and Steve Peoples in Flint, Mich., contributed to this report. ___ Catch up on the 2020 election campaign with AP experts on our weekly politics podcast, “Ground Game.”",Michigan primary could make or break Sanders' campaign,2020-03-10T04:35:05Z,https://apnews.com/5b4fa2256d232ca24b2f93fff3131e99,AP
"NEW YORK (AP) — One of President Donald Trump’s first impulses in response to the outbreak of the coronavirus in China was to suggest it was a buying opportunity in the U.S. stock market. Even as the global peril of the virus has escalated, Trump has leaned hard on his decades of experience as a businessman, keeping his focus on the economy and financial markets and urging people to continue traveling and patronizing U.S. businesses.  “You know, a lot of people are staying here and they’re going to be doing their business here,” he said Friday, as stocks fell again and the tally of infected in the U.S. climbed. “They’re going to be traveling here. And they’ll be going to resorts here.”  And possibly to the president’s own resorts. The virus provides the latest example of how the president’s public and personal interests are interwoven, but this time driven by a crisis with major global health implications in addition to financial ones. “If there is any public health shutdown of restaurants, conventions and meetings, that will impact his property and his finances,” said Kathleen Clark, an ethics lawyer at Washington University School of Law in St. Louis and frequent critic of the president. “I think a reasonable person can conclude that he is motivated by personal interests.” All of Trump’s properties, at home and abroad, would stand to suffer if travel and tourism business continues to evaporate. A business travel group is estimating revenue losses globally of nearly $50 billion per month. Trump’s comments Friday are the latest rosy depiction of the crisis as he has tried to brush past the economic impact. No president has more closely tied his political fortunes to the stock market, and a slowdown in the nation’s economy could imperil his reelection hopes. Trump has peppered his economic advisers with questions about the virus’ impact and has boasted about the strength of the economy. “We have a great economy. We have a very strong economy,” Trump insisting during an appearance Monday in the White House briefing room. Though a self-proclaimed firewall exists between Trump and the company that bears his name, the president has been known to ask his business associates, and namely his adult sons now its titular heads, how his properties are faring, according to two Republicans close to the White House not authorized to speak publicly about private conversations. And in recent days, Trump was slow to embrace federal recommendations against the elderly boarding airplanes or passengers traveling on cruise ships. The White House did not respond to a request for comment as to whether the president’s handling of the epidemic was informed by the impact it could have on his properties.  Noah Bookbinder, executive director of the watchdog Citizens for Responsibility and Ethics in Washington, said that he isn’t sure the president is thinking of his properties right now. But in deciding to not sell his business before taking office, Bookbinder said, the president has raised doubts about his motives and that in itself is damaging.  “We have to ask with almost every major policy decision whether he’s acting in the country’s interest or his own interest,” Bookbinder said. “In a time of crisis like this, being able to trust our institutions, that our government is making the right decision for our health, economy and security is incredibly important.” For now, the privately held Trump Organization doesn’t appear to have taken a blow.  As the coronavirus panic began to settle in during the first week of March, the high-vaulted lobby of his hotel in Washington and its bar remained crowded with visitors, including many sporting Trump’s trademark red campaign hats.  Next up, dozens of bankers from Texas who are planning a reception at the hotel on March 22 as part of a four-day visit to the capital. A spokeswoman for the group sponsoring the trip, the Texas Bankers Association, said that none of 81 registered to attend had pulled out yet. “I haven’t seen much of a drop off — if at all,” said Zach Everson, a frequent visitor who writes an online newsletter about the hotel called 1100 Pennsylvania Ave. He added, referring to a recent visit, “It was packed.”  So too was the president’s Mar-a-Largo in Palm Beach, Florida, last weekend. On Sunday, the venue threw a birthday party for Donald Trump Jr.’s girlfriend, and social media posts showed the place was jammed. The day before Trump hosted a dinner for Brazilian President Jair Bolsonaro. Still, the Trump properties can ill afford a downturn in business. The Trump Organization has been struggling from lost business due to a backlash against the president’s rhetoric and his policies. Several buildings licensing his name have stripped it from their facades, major groups have canceled events at his resorts, and his Scottish golf clubs continue to lose millions. Even his Washington hotel, for all its buzz, is showing signs of struggling, as rooms stand empty. The Trump Organization recently put the hotel up for sale. The company did not respond to requests for comment. Trump has long governed with an eye toward increasing profits at his properties.  Since taking office, he has spent hundreds of days at his properties, particularly in Florida and New Jersey, the visits providing valuable promotional material. Moreover, the Trump Organization profits off the federal employees — including White House staff and Secret Service — who then need to stay alongside Trump in Palm Beach or Bedminster, New Jersey, one of 17 Trump golf resorts around the world. Trump has also floated hosting the international G7 at his property outside of Miami, only to relent after being met by howls of protests from Democrats and civic watchdogs. When it comes to Trump’s response to the current crisis and potential conflicts with his vast financial interests, not all ethics expert are bothered. Edwin Williamson, a former State Department legal adviser, said that even if Trump had sold his properties before he took office and put the money into a stock or bond fund, as ethics rules suggest of many federal officials, critics might be raising questions. “Anyone who had a highly diversified funds under the rules would still have the same issue,” said Williamson. “Did you see what the market did today?” The Dow Jones index plunged 7.8 percent Monday, its steepest drop since the 2008 financial crisis. Brian Friedman, owner of the Kimpton Glover Park among other Washington hotels and a bidder on the Trump hotel, said a falling stock market can wallop the front desk because people don’t want to travel as much when they feel less wealthy. Throw in a virus, he said, and Trump, along with everyone else in the business, is going to take a big hit. “I don’t know of any big cancellations. I have not seen the impact yet,” Friedman said. “But I do think it’s going to come.”",Trump talks down virus as his properties face possible hit,2020-03-10T00:05:20Z,https://apnews.com/a5e4261f40050e07ad3b6b9eb04694aa,AP
"WASHINGTON (AP) — American troops have begun leaving Afghanistan for the initial troop withdrawal required in the U.S.-Taliban peace agreement, the U.S. military confirmed Monday, amid political chaos in Kabul that threatens the deal. Army Col. Sonny Leggett, spokesman for U.S. forces in Afghanistan, said in a statement that the U.S. is moving ahead with plans to cut the number of forces in the country from about 13,000 to 8,600 over the next four and a half months. Another U.S. official said hundreds of troops have headed out of the country as previously planned, but they will not be replaced. The official spoke to The Associated Press on the condition of anonymity to discuss the movement ahead of a public announcement. The pullout comes as Afghanistan’s rival leaders were each sworn in as president in separate ceremonies Monday, creating a complication for the United States as it figures out how to move forward on the deal and end the 18-year war. The sharpening dispute between President Ashraf Ghani, who was declared the winner of last September’s election, and his rival Abdullah Abdullah, who charged fraud in the vote along with the elections complaints commission, threatens to wreck the next key steps and even risks devolving into new violence. The U.S. has not tied the withdrawal to political stability in Afghanistan or any specific outcome from the all-Afghan peace talks. Instead, it depends on the Taliban meeting its commitment to prevent “any group or individual, including al-Qaida, from using the soil of Afghanistan to threaten the security of the United States and its allies.”  Under the peace agreement, the U.S. troop withdrawal had to begin within 10 days after the deal was signed on Feb. 29. Defense Secretary Mark Esper said March 2 that he had already approved the start of the withdrawal, which would then be coordinated by military commanders in Afghanistan. The U.S. official said the troops leaving now had been scheduled to depart, but they will not be replaced. Esper has said Gen. Scott Miller, the U.S. commander in Kabul, will pause the withdrawal and assess conditions once the troop level goes down to 8,600.  Leggett said the U.S. military in Afghanistan will maintain “all the military means and authorities to accomplish our objectives, including conducting counterterrorism operations” against al-Qaida and the Islamic State’s affiliate in the country, and will maintain support for Afghan forces.. The long-term plan is for the U.S. to remove all troops within 14 months if security conditions are met. The agreement with the Taliban followed a seven-day “reduction in violence” period that, from the Trump administration’s viewpoint, was meant to test the Taliban’s seriousness about moving toward a final peace agreement.","US begins troop withdrawal from Afghanistan, official says",2020-03-09T16:09:06Z,https://apnews.com/2e8a815a031e8da37075feec466694c2,AP
