article_text,article_title,date,link,publisher
"WASHINGTON (AP) — House Speaker Nancy Pelosi and the Trump administration hoped to announce an agreement Friday on a coronavirus aid package to reassure anxious Americans by providing sick pay, free testing and other resources in an effort to calm teetering financial markets and the mounting crisis. Final details were being worked out, but the top House Democrat, who held daylong talks with Treasury Secretary Steven Mnuchin, expected an announcement Friday. The House could then swiftly vote. Mnuchin said Friday morning that negotiations were going very well. “I think we’re very close to getting this done,” Mnuchin said, appearing on CNBC.  On the COVID-19 illness, Mnuchin cautioned that “people should understand the numbers are going to go up before they go down.” Emerging from her office at the Capitol late Thursday, Pelosi said an agreement on an aid package was near. She said a deal was “subject to an exchange of paper and we hope to have an announcement tomorrow.” Pelosi and Mnuchin spoke again early Friday. The potential deal between Congress and the White House would cap a tumultuous week in which Washington strained for a comprehensive response to the outbreak that is testing the nation’s political, financial and health care systems. President Donald Trump has struggled to show he’s on top of the crisis, after delivering conflicting descriptions of what the U.S. is doing to combat the virus. Classes, sports events, concerts and conferences have been canceled across the nation and the financial markets have been cratering. The House aid package builds on an emergency $8.3 billion measure approved last week and is aimed at providing additional health and financial resources to arrest the sudden spread of the pandemic and the kind of economic fallout unseen in a generation. Pelosi promised in a letter to colleagues that a third package was yet to come. The new sick leave benefit would require businesses to provide up to 14 days of paid leave to workers who are home quarantined with the virus, with the federal government reimbursing them through tax credits. The bill facilitates unemployment benefits for those laid off during the crisis and boosts food and nutrition programs for working families, students and seniors. Work requirements for food stamps would be suspended, and states would be given additional Medicaid funds to cope with the crisis. “We felt that putting together something that the American people can see cooperation on between the two parties in this difficult moment would be a confidence builder,” said Rep. Richard Neal, D-N.J., the chairman of the Ways and Means Committee. Pelosi promised the third coronavirus package will follow soon, though the House is leaving Washington on Friday for a previously scheduled recess. That measure will include more aggressive steps to boost the U.S. economy, which economists fear has already slipped into recession.  But there’s little appetite within either party for Trump’s proposal to suspend collection of the 6.2% Social Security payroll tax, and Democratic economic stimulus ideas like higher more generous food stamp benefits aren’t favored by Republicans, while Democrats aren’t very friendly to GOP ideas like easing business regulations. States are already clamoring for fiscal relief from Washington as the virus threatens their budgets. Mnuchin, however, said on Friday that the president remains committed to pursuing the payroll tax cut. “It is a giant stimulus.”  Disruptions from the virus spread throughout the Washington metropolitan area, as the Capitol, White House and Supreme Court all declared themselves off limits to the public for now, symbols of a nation hunkering down. And schools in the District of Columbia announced they would close, starting Monday, until April 1.  The storied Smithsonian said it was canceling all public events and will temporarily close its network of museums and the National Zoo, starting Saturday. And Trump proposed postponing this summer’s Olympics in Japan for a year, too. Trump said he will halt his signature campaign rallies, telling reporters he needs a “little separation until such time as this goes away.” Democratic presidential rivals Joe Biden and rival Sen. Bernie Sanders said they would no longer hold large political gatherings and their staffs would work from home as the race for the presidency moved online. The coronavirus crisis also got personal for Trump and some members of Congress.  Australian Home Affairs Minister Peter Dutton was in isolation at a hospital after testing positive for the coronavirus. He returned to Australia on Sunday from Washington, where he met Attorney General William Barr and Trump’s daughter, Ivanka, last week.  White House officials, including representatives for Ivanka Trump, have not responded to questions about whether they intend to be tested or self-quarantine. The White House has insisted officials are following CDC guidelines and that, “there is currently no indication to test patients without symptoms, and only people with prolonged close exposure to confirmed positive cases should self-quarantine.” Barr, meanwhile, was staying home Friday, though he “felt great and wasn’t showing any symptoms,” according to his spokeswoman Kerri Kupec. She said the CDC did not recommend testing at this point.  In addition, just days after meeting Trump and Sen. Rick Scott, R-Fla., the communications chief for Brazil’s president, Fábio Wajngarten, tested positive for coronavirus. A photo of the president, the senator and Wajngarten shows the trio shoulder-to-shoulder at Trump’s Mar-a-Lago resort last weekend. Scott said he was isolating himself. Trump, 73, said he was unworried.  “We had dinner in Florida at Mar-a-Lago with the entire delegation,” Trump told reporters at the White House. “But we did nothing very unusual. We sat next to each other for a period of time.” Asked whether he should be tested, Trump replied, “I am not concerned.” White House spokeswoman Stephanie Grisham said “the White House is aware of public reports that a member of the Brazilian delegation‘s visit to Mar-a-Lago last weekend tested positive for COVID-19” though; confirmatory testing is pending.  She said: “Both the President and Vice President had almost no interactions with the individual who tested positive and do not require being tested at this time.” GOP Sen. Lindsey Graham, who was also at Trump’s club on the weekend, joined a growing list of lawmakers who have chosen to isolate themselves as a precaution. Lawmakers from both parties expressed alarm at the U.S. response, and especially over the fact few patients have been tested.  “We’re basically, in my opinion, flying blind,” said Rep. Susie Lee, D-Nev.  Dr. Anthony Fauci, infectious disease chief at the National Institutes of Health, in several television interviews Friday, said more tests would be available over the next week, but that officials should not wait before trying to mitigate the virus’ effects.  “We will have considerably more testing in the future, but you don’t wait for testing,” Fauci said on ”CBS This Morning.” He said school closings and similar measures are “generally an appropriate approach.” “We’re at a critical point now as we seek to blunt the rise in cases to make sure it’s a hill, not a mountain,” Fauci said on ABC’s “Good Morning America.” For most people, the new coronavirus causes only mild or moderate symptoms, such as fever and cough. For some, especially older adults and people with existing health problems, it can cause more severe illness, including pneumonia.  The vast majority of people recover. According to the World Health Organization, people with mild illness recover in about two weeks, while those with more severe illness may take three to six weeks to be over it. In mainland China, where the virus first exploded, about 81,000 people have been diagnosed and about 64,000 have recovered. Trump’s Wednesday announcement of travel restrictions prompted clarifications, criticisms and confusion. While Trump said all European travel except from Britain would be cut off, Homeland Security officials clarified that the new travel restrictions would apply only to most foreign nationals who have been in the Schengen Area at any point in the 14 days prior to their scheduled arrival to the United States. The area encompasses most European countries, among them France, Italy, German, Greece, Austria and Belgium. The restrictions don’t apply to legal permanent residents, immediate family of U.S. citizens or others identified in the proclamation signed by Trump. Vice President Mike Pence said the administration is also asking travelers returning to the U.S. from Europe to voluntarily quarantine for 14 days. Trump claimed falsely Thursday that the U.S. is currently screening all Americans and foreigners who are entering the country, saying, “people coming in have to be tested.” And he claimed that those who return are being forced to isolate themselves, adding: “It’s going to be a pretty strong enforcement of quarantine.” No widespread quarantine orders have been announced. ___ Associated Press writers Aamer Madhani, Lauran Neergaard, Martin Crutsinger, Laurie Kellman, Michael Balsamo and Kevin Freking in Washington and Bill Barrow in Atlanta contributed to this report. ___ The Associated Press receives support for health and science coverage from the Howard Hughes Medical Institute’s Department of Science Education. The AP is solely responsible for all content.","Pelosi, White House near agreement on coronavirus aid bill",2020-03-13T12:37:22Z,https://apnews.com/83b0c8e168548fd453b0c177dd1f203a,AP
"WASHINGTON (AP) — President Donald Trump will hold a press conference to address the spiraling coronavirus pandemic as he seeks to calm a panicked nation amid mixed messages and growing criticism of his administration’s scattershot response. “I will be having a news conference today at 3:00 P.M., The White House,” Trump tweeted. “Topic: CoronaVirus!” The news conference comes as the virus edged ever closer to the world’s power centers, including a positive test for a Brazilian official who spent time with Trump and top administration officials last weekend and an Australian Cabinet minister who met with U.S. Attorney General William Barr and Trump’s daughter Ivanka among other top aides. And it comes as the world has been lurching to try to contain the virus’s spread, with millions of students staying home across three continents, large gatherings canceled and more and more bars, restaurants and offices closures.",Trump to hold news conference as he seeks to calm virus fear,2020-03-13T15:22:24Z,https://apnews.com/663e745a80358c042786d2a562409b36,AP
"President Donald Trump’s administration announced Friday it is awarding $1.3 million to two companies trying to develop rapid COVID-19 tests that could detect whether a person is positive for the new coronavirus within an hour. The Department of Health and Human Services said it is awarding $679,000 to DiaSorin Molecular, of Cypress, California, and $598,000 to QIAGEN, of Germantown, Maryland, to accelerate development of their tests. DiaSorin’s test could be ready within six weeks for consideration by the U.S. Food and Drug Administration, and the QIAGEN test could be ready within 12 weeks for FDA consideration, according to HHS. For most people, the new coronavirus causes only mild or moderate symptoms, such as fever and cough. For some, especially older adults and people with existing health problems, it can cause more severe illness, including pneumonia. The vast majority of people recover from the new virus. According to the World Health Organization, people with mild illness recover in about two weeks, while those with more severe illness may take three to six weeks to recover. In mainland China, where the virus first exploded, about 81,000 people have been diagnosed and about 64,000 have recovered. ___ The Associated Press receives support for health and science coverage from the Howard Hughes Medical Institute’s Department of Science Education. The AP is solely responsible for all content.",Trump administration: $1.3M for fast virus test development,2020-03-13T13:13:09Z,https://apnews.com/d7cb8610b50a2e79ce1a72929f23f02b,AP
"The chairwoman of the Congressional Black Caucus has endorsed Joe Biden for president, an influential nod of support that could bolster his 2020 Democratic campaign. The endorsement by Democratic Rep. Karen Bass of California on Friday is the latest testament of a growing coalescence of support for Biden’s White House bid. Biden’s campaign has seen a resurgence powered by black voters, who have helped cement his front-runner status after commanding wins in several recent primaries, including in South Carolina, in several Southern states and just this week in Michigan.  “It’s very clear to me that he is the best person, not just to beat (President Donald) Trump, but he is the person to lead at this time,” Bass said in an interview with The Associated Press. “I think him having a long-standing history of working with African American communities, most notably in his own state but around the country, was qualitatively different from the other candidates.” Biden’s progressive rival, Sen. Bernie Sanders of Vermont, who has performed well among younger and Latino voters, has struggled to garner support within the African American community. Black voters will continue to be a key demographic as both campaigns eye upcoming primary contests in states with large black populations, like Georgia. Bass said she held off endorsing a candidate because two CBC members, Cory Booker and Kamala Harris, were running for president. Booker and Harris have since dropped out and endorsed Biden, a former vice president and U.S. senator from Delaware. The CBC as a whole is not officially endorsing a candidate, Bass said, but the majority of members have already announced support for Biden. The powerful group, created in 1971, is composed of most African American members of Congress, making up nearly 25% of the Democratic majority in the House. Of the 54-member group, 37 have endorsed Biden, including House Majority Whip Jim Clyburn, who has been credited with helping turn the tide for Biden with a big win in Clyburn’s home state of South Carolina. One member of the CBC, Democratic Rep. Ilhan Omar of Minnesota, has endorsed Sanders. Although Biden has strong support within the African American community, especially among older voters, concerns have been raised about his ability to energize young and progressive voters. Bass, a progressive Democrat who is serving her fifth term in a congressional district that includes south Los Angeles and Culver City, said she believes Biden would be able to grow support among those groups, if he were to become the eventual nominee. “As this race settles down, it is my job personally and the job of members of the Congressional Black Caucus to be extremely clear with people in our districts what is at stake here, and what is at stake is their future,” Bass said. “It’s a job that we’ve all been doing over the last 3 1/2 years, but we have to step it up.” Asked whether Sanders and Rep. Tulsi Gabbard of Hawaii should drop out of the race to unite the party before the Democratic National Convention, Bass said she believes the primary process needs to run its course and allow every voter the chance to weigh in. “I would never be in a position to say, ‘You need to drop out,’” Bass said. “I do think, though, that math is math.” She continued: “I think they have to do the soul searching and say, ‘Why am I still doing this?’ But I think that’s an individual decision or a campaign decision.” Bass said she hopes, though, that the eventual nominee considers a person of color as his running mate. “I think that a presidential candidate has got to choose somebody that they feel that they can trust, that they can work with,” Bass said. “Now, having said that, I certainly hope it’s a woman. I certainly hope it’s a woman of color.” ___ Kat Stafford is a member of The Associated Press’ Race and Ethnicity team. Follow her on Twitter at https://twitter.com/kat__stafford. ___ Catch up on the 2020 election campaign with AP experts on our weekly politics podcast, “Ground Game.”",Chairwoman of Congressional Black Caucus endorses Joe Biden,2020-03-13T12:00:17Z,https://apnews.com/0c26235718a02157e5831933f57545a4,AP
"MIAMI (AP) — Florida has never been known as a place of stability, especially in its politics. And yet stability is what has been on the minds of many Democrats in the state who say they’ll vote for former Vice President Joe Biden in Tuesday’s presidential primary election instead of Vermont Sen. Bernie Sanders. “I like some of Sanders’ ideas, but he’s a little too extreme for me,” said Jeanne Hilburn, a 76-year-old retired teacher who lives in the suburbs of Tampa. “A lot of Democrats are like me — we want stability.” As the race for the Democratic nomination enters a penultimate phase, with Sanders’ campaign on the brink of collapse and Biden’s ascendant, attention is turning to places like Florida, which is holding its primary on Tuesday along with Ohio, Illinois and Arizona. Florida has 219 delegates, the biggest prize of next week’s election. Few places hold the electoral cachet of Florida, which has been among the most coveted swing states in the last three decades, including during the contentious, chaotic recount of 2000. It is a vital state for President Donald Trump, who would have almost no path to reelection without it. Biden’s advisers are banking on a decisive Florida victory that sends a clear message that he is much better positioned to win the state and deny Trump a second term. In 2016, Trump defeated Hillary Clinton here by 1.2 percentage points. “Florida, as always, is pivotal in the outcome,” said Nikki Fried, who is the state’s agriculture commissioner and top elected Democrat and who endorsed Biden. “We are the ultimate swing state.” Sanders’ support in Florida has always been tenuous. In the 2016 primary, he lost to Clinton by a nearly 2-to-1 margin. This year, Sanders angered a potentially large voting bloc — Cuban Americans — by praising Fidel Castro for implementing a literacy program in the communist nation. “There is nothing positive you can say about the conditions in Cuba. If he doesn’t understand that, it is hard to conceive that he will get any votes,” said Xavier Suarez, who was the first Cuban-born mayor of Miami and is now running as an independent in the county mayoral race. “It’s gonna be a massacre.” That leaves many Florida Democrats looking beyond the primary to November. Several groups have banded together to register people to vote and mobilize for November.  One of the four groups, Organizing Together 2020, is led by Fried. It will hire employees, register voters, train volunteers and then turn everything over to the party after the July convention. Another of the groups is For Our Future, a super PAC that is made up largely of Mike Bloomberg’s campaign apparatus.  A strong turnout in the Florida primary could give hope to Democrats, though it would be difficult to draw any conclusions for November given the state’s high number of independents. And, to be sure, the coronavirus outbreak could keep some voters away from the polls and muffle any message from the turnout. Democrats know it will be a challenge to sway voters here. About 3.6 million of the state’s 13.6 million voters are registered independents, which means they can’t vote in Tuesday’s primary but are eligible to cast ballots in the general election. “Florida is an interesting state. Depending on where you’re at, we can be very conservative, or we can be very progressive,” said St. Petersburg Mayor Rick Kriseman, a Democrat. “We also have a strong moderate and independent streak. Biden, I think he’ll do well here with Democrats and independents. And with Republicans who are looking for an alternative to President Trump.” Ashley Walker, of Organizing Together, said a priority is grassroots door-knocking in counties that were close in 2016, like Pinellas, home to St. Petersburg, which Trump won by 5,500 votes, and in Pasco, a suburban county just north of Tampa where voters moved to Republican candidates in the 2018 Senate and gubernatorial races. Walker says the aim is to siphon off votes there. “The margins matter. We’re probably not going to win Pasco County, but we’re going to need to close the margins so we lose less badly,” she said. “And in those counties that go back-and-forth between red and blue, like Pinellas, it’s especially important to get organized early. To build relationships early.” Similarly, Biden’s supporters have been paying visits to Spanish-language TV shows and broadening “diaspora outreach” efforts in South Florida. John Kerry, the former secretary of state and the Democratic presidential nominee in 2004, spoke about Latin America policy on behalf of Biden’s campaign at a restaurant in Doral, the hub of Venezuelan exiles.  “We feel good about where we are in the state, but we are not taking anything for granted,” said Carmen Torres, of Florida Hispanics for Biden. Democrats don’t have a lock on the Latino vote in Florida, particularly among the nearly 2 million residents who are originally from Cuba, Venezuela and Nicaragua, where authoritarian socialist regimes have soured many exiles toward any left-leaning politicians. A third of Cuban American midterm voters identify as Democrats, according to AP Vote Cast, a wide-ranging survey of the elecotrate. But the survey said a majority, 56%, of Cuban American midterm voters expressed approval of the way Trump was handling his job as president.  Daisy Baez, a former Democratic state lawmaker, is leading a group called “Dominicanos con Biden” to rally her fellow Dominican Americans to support the former vice president. A similar effort to rally Venezuelans will roll out on Sunday. “We wanted to address our message to a specific community,” Baez said. “We needed to piece it down in smaller parts.” As Sanders’ chances diminish, Biden may also need to win over his challenger’s fervent supporters if an endorsement follows. Some may not follow suit. Nick Mora, 24, a Florida International University Student, marched alongside 20 students on a recent afternoon on campus to persuade others to vote early for Sanders. Mora acknowledged Sanders’ defeat earlier this week was disappointing but said they were not ready to give up yet. “Let’s just say Joe Biden does not have the same policy proposals as Bernie,” Mora said. “I feel like the progressive movement is being pushed down, and there’s not much we can do about it if we vote for Joe Biden, so we are still trying to fight till the end.” ___ Lush reported from St. Petersburg, Fla. ___ Catch up on the 2020 election campaign with AP experts on our weekly politics podcast, “Ground Game.”",Florida could be knockout punch for Sanders’ 2020 campaign,2020-03-13T04:24:56Z,https://apnews.com/9d7d4614b0a33fb63e68ecb666b0d6da,AP
