article_text,article_title,date,link,publisher
"Senate Homeland Security and Governmental Affairs Committee Chairman Ron Johnson (R-WI) has scheduled a vote for the committee next Wednesday to subpoena former Ukrainian politician Andrii Telizhenko, who may shed insight into Hunter Biden’s potential role in trying to help Ukrainian natural gas firm Burisma Holdings evade corruption charges. A committee meeting to consider a motion to subpoena Telizhenko is scheduled for March 11 at 2:30 p.m., according to a public posting on the committee’s website. The motion will likely pass, with a majority of Republicans on the committee. Telizhenko was a former Ukrainian diplomat. He worked at Ukraine’s embassy in Washington, DC, between December 2015 and June 2016, as the U.S. presidential campaign was underway, according to the Daily Beast. Telizhenko has claimed that former Ukrainian Embassy Deputy Chief of Mission Oksana Shulyar worked with former Democratic National Committee (DNC) consultant Alexandra Chalupa, a Ukrainian-American, to help the Hillary Clinton campaign investigate then-Trump campaign manager Paul Manafort. He told Politico in a January 2017 article that Shulyar instructed him to help Chalupa research connections between Trump, Manafort, and Russia. “Oksana said that if I had any information, or knew other people who did, then I should contact Chalupa,” he said. “They were coordinating an investigation with the Hillary team on Paul Manafort with Alexandra Chalupa.” He added, “Oksana was keeping it all quiet [but] the embassy worked very closely with” Chalupa. Other “sources familiar with the effort” told Politico that Shulyar called Telizhenko into a meeting with Chalupa to provide an update on an American media outlet’s ongoing investigation into Manafort. He said Chalupa told him and Shulyar, “If we can get enough information on Paul [Manafort] or Trump’s involvement with Russia, she can get a hearing in Congress by September [2016].” Chalupa confirmed to Politico that she had discussed the possibility of a congressional investigation with the office of Rep. Marcy Kaptur (D-OH), co-chair of the Congressional Ukrainian Caucus, but that it “didn’t go anywhere.” Johnson’s subpoena to Telizhenko, however, is focused on his work as a consultant for Blue Star Strategies, a firm Burisma hired to fight allegations of corruption it was facing. Burisma appointed Hunter Biden to its board in 2014, after his father became the point person in the Obama administration for Ukraine and as the firm’s CEO was facing allegations of corruption and money laundering. Despite having no relevant experience, he was receiving up to $83,000 a month. After Biden’s appointment to the board, Burisma hired Blue Star Strategies to help them fight off the allegations of corruption and to lobby U.S. officials on its behalf. The New York Times reported in May 2019 that Hunter Biden was linked to Burisma’s hiring of Blue Star Strategies. “Among the Americans brought in by Hunter Biden’s American business partners to help fend off the investigations was Blue Star Strategies, a consulting firm run by Clinton administration veterans that had done substantial work in Ukraine,” the report said. Biden had links to one of Blue Star Strategies’ co-founders — Sally Painter, a former senior adviser for the Clinton administration. He knew Painter from the Truman National Security Project, an organization for young national security experts on the left. Biden and Painter were both directors of the organization at the same time, according to the Washington Free Beacon. The other co-founder was Karen Tramontano, a former deputy chief of staff to President Clinton. While Painter was working for Burisma, she moderated a panel at a Truman National Security Project event on June 24, 2016. Then-Deputy Secretary of State Tony Blinken had spoken earlier at that event. Three days later, she contacted Blinken’s then-aide William Russo, to schedule a meeting with Blinken and Tramontano to discuss Ukraine, according to the Daily Caller. Painter wrote to Russo, who currently serves as director of communications for Biden’s presidential campaign, “Per my conversation with Tony at the Truman event, Karen Tramontano and I would like to have a brief coffee with Tony at his earliest convenience regarding some troubling events we are seeing n [sic] Ukraine.” “(He said yes),” she added, referring to Blinken, who currently serves as foreign policy advisor to Biden’s presidential campaign. “We are just back from Kiev.” According to the Times, a team from Blue Star Strategies, including John Buretta, a lawyer who served as a senior official in the Obama Justice Department, had two meetings in Ukraine with its top prosecutor, Yuriy Lutsenko, in 2016. Lutsenko replaced Viktor Shokin, whom Joe Biden has stated publicly he pressured Ukraine to fire. Lutsenko had taken a hard line against Burisma, but within 10 months of taking office, Burisma announced he and the Ukrainian courts had “fully closed” all “legal proceedings and pending criminal allegations” against Burisma’s CEO and his companies and that he had been removed by a Ukrainian court from “the wanted list,” according to the Times. Sen. Johnson said in a March 1, 2020, letter to colleagues that he has received U.S. government records indicating that Blue Star Strategies sought to use Hunter Biden’s role as a board member of Burisma to “gain access to, and potentially influence matters at, the State Department.” He said the committee has also requested and received documents from Blue Star Strategies and Telizhenko. However, he said Telizhenko said he cannot turn over all relevant records unless he is compelled by a subpoena, since some of them are subject to a non-disclosure agreement in his employee contract and Blue Star Strategies has been unwilling to turn over the records, according to Johnson’s letter. “Because Mr. Telizhenko’s records and information would be responsive to the Committee’s requests, and Blue Star [Strategies] has refused to produce them, a subpoena to Mr. Telizhenko for these records is appropriate at this time,” Johnson wrote. Democrats have blasted the subpoena as an attempt to hurt Joe Biden in the 2020 presidential election, although Johnson’s efforts were in the works weeks before he announced this week he would seek a subpoena. His committee’s investigation into Burisma has also been going on for nearly a year. Sen. Mitt Romney (R-UT) reportedly was considering voting against the motion, but CNN reported Friday that he would vote to pass the motion — likely ensuring its passage — after receiving assurances from Johnson that the investigation would not become a public spectacle. Johnson also announced this week that he would likely issue an interim report within a month or two focused on what Joe Biden knew about his son Hunter Biden’s role at Burisma.   Follow Breitbart News’s Kristina Wong on Twitter or on Facebook.",Senate GOP Investigation into Burisma-Biden Heats Up with Subpoena Planned Next Week,2020-03-07,https://www.breitbart.com/politics/2020/03/07/senate-gop-investigation-into-burisma-biden-heats-up-with-subpoena-planned-next-week/,Breitbart
"Left-wing actress Bette Midler took her public disdain for President Donald Trump up a notch on Friday, defending “powerhouse” Sen. Elizabeth Warren (D-MA) from the president’s critiques, calling him the “most hated, most repulsive human male on the planet today.” “#EllizabethWarren is a powerhouse, but Donald Trump, that stable genius, said she was unlikeable,” the Beaches actress said one day after Warren’s announcement. “Well, Don, in breaking news, she’s 100% more likable than you! You are the most hated, most repulsive human male on the planet today, & God knows, there are plenty to choose from.” #EllizabethWarren is a powerhouse, but Donald Trump, that stable genius, said she was unlikeable.  Well, Don, in breaking news, she's 100% more likable than you!  You are the most hated, most repulsive human male on the planet today, & God knows, there are plenty to choose from. — Bette Midler (@BetteMidler) March 7, 2020  Trump on Friday spoke about Warren’s departure from the Democrat presidential primary race, attributing her political demise to a “lack of talent” and citing her likability factor. “People don’t like her. She’s a very mean person, and people don’t like her,” Trump explained. “People don’t want that. They like a person like me that’s not mean.” Despite her defense of Warren, Midler affirmed her support for Mike Bloomberg (D) on Super Tuesday, telling her 1.8 million followers that she was “all in” for the former New York City mayor. “TODAY IS SUPER TUESDAY, as if you didn’t know. And I am all in for @MikeBloomberg. Rail at me all you want, but I saw New York City go from being down on its knees to standing upright and proud after 9-11,” the Hocus Pocus actress said. “It was a long haul, tough; not without mistakes, but he got it done.” TODAY IS SUPER TUESDAY, as if you didn't know.  And I am all in for @MikeBloomberg.   Rail at me all you want, but I saw New York City go from being down on its knees to standing upright and proud after 9-11.  It was a long haul, tough; not without mistakes, but he got it done. — Bette Midler (@BetteMidler) March 3, 2020  Despite backing from high-profile Hollywood figures like Midler, Bloomberg’s Super Tuesday strategy did not materialize, and he subsequently dropped out of the race and threw his support behind Joe Biden (D). Last month, the actress-singer freaked out over one of the president’s tweets, warning that he will “rule you until he dies, you die, or both.” HE PINNED THIS.  YOU THINK THIS IS A JOKE, DON’T YOU? IT’S NOT.  HE MEANS IT. HE WILL CHANGE THE RULES AND HIS ENABLERS WILL LET HIM.  IF HE WINS AGAIN, HE WILL RULE YOU UNTIL HE DIES, YOU DIE, OR BOTH. THEN…YOU’LL GET IVANKA. https://t.co/qdx1bZme80 — Bette Midler (@BetteMidler) February 6, 2020 ","Bette Midler Defends ‘Powerhouse’ Elizabeth Warren: Trump Is the ‘Most Hated, Most Repulsive Human Male’",2020-03-07,https://www.breitbart.com/entertainment/2020/03/07/bette-midler-defends-powerhouse-elizabeth-warren-trump-is-the-most-hated-most-repulsive-human-male/,Breitbart
"Rep. Ken Buck (R-CO) responded on Friday to Joe Biden and Robert “Beto” O’Rourke’s gun control partnership by signaling they will have to “come and take it” if they want his AR-15. Buck posted a video, addressed to Biden and O’Rourke, saying, “If you want to take everyone’s AR-15 in America, why don’t you swing by my office in Washington, DC, and start with this one?” He then turned and removed an AR-15 from his office wall and stated, “Come and take it”: I have just one message for Joe Biden and Beto O’Rourke, if you want to take everyone’s AR-15s, why don’t you swing by my office in Washington, D.C. and start with this one?  Come and take it. #2A pic.twitter.com/jG2SiXetov — Congressman Ken Buck (@RepKenBuck) March 6, 2020  O’Rourke responded to the video by suggesting Buck “makes the case for both an assault weapons ban and a mandatory buyback program,” the two key gun control components of O’Rourke’s failed presidential campaign. On May 4, 2018, Breitbart News reported that President Trump used his speech at the NRA convention to recount the Battle of Gonzales, Texas, where the battle cry “Come and Take It” was born. Trump said: In 1835, soldiers from General Santa Anna’s army marched into the little Texas town of Gonzales and ordered those Texans to surrender their small cannon that they relied on to protect their lives and protect their homes. The Texans refused! They were not about to give up their only means of self-defense. He continued: In response, Santa Anna’s army returned with a large group of additional people. They had men all over the place … [but] this time, they were met by dozens of Texans … who had rushed to Gonzales to defend their rights and their freedom. As Santa Anna’s men watched from a distance, those brave Texans raised a flag for all to see. On the banner, they painted a cannon along with four words that echoed through the ages. It said, “Come and Take It.” The crowd broke into deafening applause, then broke into a chant of “USA! USA! USA!” AWR Hawkins is an award-winning Second Amendment columnist for Breitbart News and the writer/curator of Down Range with AWR Hawkins, a weekly newsletter focused on all things Second Amendment, also for Breitbart News. He is the political analyst for Armed American Radio. Follow him on Twitter: @AWRHawkins. Reach him directly at awrhawkins@breitbart.com. Sign up to get Down Range at breitbart.com/downrange.",Rep. Ken Buck to Biden and O’Rourke: You Want My AR? ‘Come and Take It’,2020-03-07,https://www.breitbart.com/politics/2020/03/07/ken-buck-biden-orourke-want-ar-come-take-it/,Breitbart
"Actress and climate activist Jane Fonda has endorsed Bernie Sanders for president, calling him the “climate candidate” prior to leading her latest environmental protest in Southern California. During her demonstration, the actress decried oil and gas companies while blaming “a small bunch of white men getting really rich” for causing pollution and health problems for those who live near drilling sites. Jane Fonda led a demonstration Friday in San Pedro and the suburb of Wilmington to protest the fossil fuel industry, demanding that companies put a stop to new drilling activity. The Hollywood star spoke to USA Today before the rally, saying that Sen. Bernie Sanders (I-VT) is the only presidential candidate who is running to protect the environment. “We have to get a climate president in office, and there’s only one right now, and that’s Bernie Sanders,” she told the newspaper. “So, I’m indirectly saying I believe you have to support the climate candidate.” Fonda joins a growing list of celebrities backing Sanders’ campaign. The socialist candidate has already garnered support from stars including Cardi B, Lizzo, Susan Sarandon, Mark Ruffalo, and Kirsten Dunst. “There’s a small bunch of white men getting really rich while they’re destroying the health of the people like the people you heard from. And this is just the tip of the iceberg. And guess what: it’s happening all across the country and all across the world,” she said. “We have to say no more fossil fuels. Windmills are great, and solar panels are great, and Priuses are great. And we have to do all of that. But it’s not going to matter if we don’t stop the drilling and the fracking and the exporting and the refining of fossil fuels.” .@Janefonda at #FireDrillFridays: “There’s a small bunch of white men getting really rich while they’re destroying the health of the people like the people you heard from. And this is just the tip of the iceberg.” pic.twitter.com/9jbXupIhtZ — Charles Trepany (@CTrepany) March 6, 2020  At another stop during Friday’s protest, Fonda explained in a video posted to social media that she wants to draw media attention to drilling activity taking place around residential neighborhoods. “People’s lives are being destroyed because of the proximity of the fossil fuel industry here in Wilmington. We want to call attention to that,” Fonda said. We are ready to make a ruckus with @Janefonda and frontline communities at Warren E&P In Wilmington right now, Warren Energy & Power is putting families at risk with its toxic drilling practices. #FireDrillFriday pic.twitter.com/ILRbVO9PxC — Fire Drill Fridays (@FireDrillFriday) March 6, 2020  Fonda spoke to USA Today about being arrested five times while holding her weekly protests in Washington D.C.. She revealed that her lawyer cut a deal under which she won’t have to complete community service hours or return for a D.C. court date, provided doesn’t get arrested for three months in L.A. The actress told the newspaper that once those three months are over,  she plans on getting arrested again. “We’re protesting an existential threat that could determine the future of human life on the planet, basically,” she told USA Today. Follow David Ng on Twitter @HeyItsDavidNg. Have a tip? Contact me at dng@breitbart.com",Video: Jane Fonda Endorses ‘Climate Candidate’ Bernie Sanders at Global Warming Rally,2020-03-07,https://www.breitbart.com/entertainment/2020/03/07/video-jane-fonda-endorses-climate-candidate-bernie-sanders-at-global-warming-rally/,Breitbart
"Former Vice President Joe Biden said Friday that his campaign had raised $22 million in five days following a win in South Carolina and a surge of Super Tuesday wins. Biden’s victory in ten out of 14 states that voted on Tuesday put new life into a campaign that was left for dead just weeks before when Sen. Bernie Sanders (I-VT) was in the lead. The Democrat former vice president told his supporters all of this on a call on Friday in a fundraising update, giving them a warning that the “Bernie Brothers” would be conducting an “increasingly negative” campaign. “What we can’t let happen is let this primary become a negative bloodbath,” Biden said. “I know I’m going to get a lot of suggestions on how to respond to what I suspect will be an increasingly negative campaign that the Bernie Brothers will run.” “We can’t tear this party apart and reelect Trump,” he added. “We have to keep our eyes on the ball, in my view.” “Bernie Bros” has been the term to describe hardline Sanders supporters since his 2016 election campaign. These “Bernie Bros” have received a lot of pushback for their aggressive tactics on social media, especially on Twitter. Biden and Sanders are set to face off in the next set of primaries on Tuesday, with Idaho, Michigan, Washington, Mississippi, Missouri, and North Dakota all set to vote that day. In one poll taken among Missouri voters, Biden holds a slight edge over Sanders, and another poll taken after Sen. Elizabeth Warren’s (D-MD) exit from the race showed that Biden had a double-digit lead over Sanders.","Biden Rakes In $22 Million, Warns of Bernie Bros’ ‘Increasingly Negative’ Campaign Tactics",2020-03-07,https://www.breitbart.com/2020-election/2020/03/07/biden-rakes-in-22-million-warns-of-bernie-bros-increasingly-negative-campaign-tactics/,Breitbart
"The coronavirus outbreak revealed “moral hypocrisy” on the part of global leaders, assessed Rabbi Shmuley Boteach, author of Lust for Love: Rekindling Intimacy and Passion in Your Relationship, describing the West’s decades of dealings with both China and Iran amidst human rights abuses across prior decades as acceptance of the two states’ “moral virus.” Boteach offered his remarks on SiriusXM’s Breitbart News Sunday with special guest host Joel Pollak. “If you want to look for just how the coronavirus has exposed some of the moral rot of our society, you will notice that when China was imprisoning its own Nobel Peace Prize winner — a political dissident who died in custody and his wife was also imprisoned — when China was just brutalizing citizens for expressing an opinion, we had no issue visiting there,” said Boteach. Boteach added, “[We were] not pushing them to better their human rights record. When Iran was threatening the Jews with a second Holocaust, we had no issues whatsoever in doing the Iran nuclear agreement, and the Europeans were running there to do deals for oil, but when there was a threat to our souls, our morality, our goodness, our ethics, our values, [and] our convictions, nobody gave a damn, but the moment there was a threat to our body … ‘Oh no, I’m not going to go.'” LISTEN:  “It just kind of exposes the moral hypocrisy,” continued Boteach. “We should always have had issues with Iran, not because they have the coronavirus, but because they had a moral virus because they were not ethical people because the mullahs were monsters threatening a genocide.” American foreign policy should be grounded in human rights, Boteach determined.   “We have to be moral people, and our foreign policy should be governed not just by whether or not countries have infectious diseases, but whether they have a human rights that we Americans can respect,” Boteach said. Asked about the religious response to the coronavirus outbreak, Boteach replied, “We have to emphasize life. We have to protect life. We have to promote life.” Boteach concluded, “The correct religious response is, I think, for us to do everything we can to protect and promote life. We have to contain the virus. We have to listen to the doctors. We also have to pray, of course. We have to be prepared.” Breitbart News Sunday broadcasts live on SiriusXM Patriot 125 from 7:00 p.m. to 10:00 p.m. Eastern. Follow Robert Kraychik on Twitter.","Shmuley Boteach: Before Coronavirus, We Should Have Cut off China, Iran over Human Rights",2020-03-08,https://www.breitbart.com/health/2020/03/08/shmuley-boteach-before-coronavirus-we-should-have-cut-off-china-iran-over-human-rights/,Breitbart
"The coronavirus outbreak demonstrates the need for a healthcare “safety net,” as well as innovation only the private sector can provide, according to  University economics professor Kenneth Rogoff. Rogoff, author of This Time Is Different: Eight Centuries of Financial Folly, addressed the possible economic impacts of coronavirus in an interview on SiriusXM’s Breitbart News Sunday with host Joel Pollak. Pollak asked what economic lessons can be learned from the ongoing coronavirus spread. “There is certainly a lesson for having a safety net so that so that if you’re facing a pandemic, you could treat everyone and really have a framework [so] people aren’t afraid to come in and you can treat everyone,” replied Rogoff. Government healthcare policy must be balanced with free-market forces, added Rogoff.  “The whole world depends on the United States for the innovation in drugs and health care, and there’s a very good chance that the vaccine’s going to come from here because we have this very developed private sector, and the question is how to have a system that has both.” LISTEN:
 Government-driven redistributive responses to the coronavirus threat will be favored by those seeking expansion of state power, noted Rogoff. “If you think this would be a good idea anyways, particularly fighting inequality, then you’re not so nervous about trying to increase transfers to people to deal with that,” Rogoff said. “If it turned out the [coronvirus threat] wasn’t so bad, you kind of wanted to make the government bigger [and] you kind of wanted to do these transfers anyway, so you’re willing to err on that direction, but clearly the most effective expenditures you could make are ones that address the problem, [such as] that build up the health sector.” Rogoff proposed some possible government measures to address the coronavirus threat: “Certainly having people get free tests, for example, if they want to, or possibly finding ways to make it easier to call in sick might be a short-term solution [and among the] kinds of things to government can spend money on.” Government policy, Rogoff said, must also seek to “stem the panic,” but should aim beyond financial concerns alone. “[T]he panic is not just about [if] their money [is] in the bank. The panic is much more about people’s health.” Rogoff predicted: “We’re going to end up doing stimulus policies out of this, even in the United States, even with the civil war going on in the political sphere. They’re going to do some kind of significant fiscal stimulus this year to try to mitigate the coronavirus. Call me an optimist, but I’m expecting that.” Breitbart News Sunday broadcasts live on SiriusXM Patriot 125 from 7:00 p.m. to 10:00 p.m. Eastern. Follow Robert Kraychik on Twitter.",Harvard’s Ken Rogoff: Coronavirus Shows We Need Both Healthcare Safety Net and Private Innovation,2020-03-08,https://www.breitbart.com/radio/2020/03/08/harvard-economics-professor-coronavirus-lesson-is-need-for-healthcare-safety-net-private-sector-innovation/,Breitbart
"Sunday on ABC News’ “This Week,” former Chicago Mayor and former President Barack Obama’s chief of staff Rahm Emanuel sounded off on the 2020 presidential race amid the coronavirus outbreak. Emanuel said the coronavirus precautions preventing President Donald Trump from having his typical rallies and thus missing out on the admiration he craves will be “devastating” and will “psychologically torment him.” “This administration right now looks like they couldn’t organize a one-car parade,” Emanuel stated. “And I think here’s what’s devastating for Donald Trump — beyond the fact that this requires science, management, data and being transparent, which are all his weaknesses — you’re going to have a point that within about two months where you can’t have big events together.” He added, “He is not going to be able to have his rallies, and it is going to psychologically — the office is isolating enough, and his inability to get the admiration, the adulation from that crowds is going to psychologically torment him. And his isolation is going to get more intense, and his tweets are going to get more vicious.” Follow Trent Baker on Twitter @MagnifiTrent",Rahm Emanuel: Coronavirus Could Be ‘Devastating’ for Trump Reelection Bid,2020-03-08,https://www.breitbart.com/clips/2020/03/08/rahm-emanuel-coronavirus-could-be-devastating-for-trump-reelection-bid/,Breitbart
