article_text,article_title,date,link,publisher
"Senator Chris Murphy (D-CT) said on Sunday’s broadcast of CBS’s “Face the Nation” that officials had “no concept” of the true scope of the coronavirus outbreak because the Trump administration “didn’t see this coming.” Partial transcript as follows: BRENNAN: We’re back now with Connecticut Democratic Senator Chris Murphy, who is on the Senate committee that oversees healthcare. Connecticut is one of the 33 states with confirmed cases of coronavirus. Senator, it’s good to have you here this morning. And I’m sorry to hear about what’s happening in my home state of Connecticut. How many cases do you think there are right now? There are two that have been reported. MURPHY: Oh, listen, I imagine we have hundreds, if not thousands of cases in my state. I think we have no concept of the scope of this epidemic yet because we have not been able to test. And the fact of the matter is we can’t make good judgments about the measures we should be taking in Seattle or in Danbury or Hartford unless we are able to do these tests. And what is unforgivable is that the administration didn’t see this coming and didn’t put the resources in early to make sure that everybody had these tests available. But we are likely going to have to take much stronger measures as time goes on. But nobody understands where the epidemic is the worst until we get tests widely deployed. BRENNAN: Now, the administration says there are tests in the pipeline. They said about a million were sent out for delivery, arrival on Friday. Are you seeing that in Connecticut? MURPHY: We are not seeing that in Connecticut. We now have private lab capacity to do tests. But our understanding is that we are nowhere near that number that was proffered by the administration last year of a million. We are doing a lot more screening in our state, but we do not have the ability to give a test to everyone who wants one, as the president said was the case on Friday afternoon. And that is incredibly concerning given the fact that we saw this epidemic coming. We could have made a decision back in January or February to accept the WHO test that was available to us or start putting serious resources into developing our own test. The administration did neither and they did neither, because this president has created a culture of misinformation in which no one wants to give him bad news. And that created a disincentive in the White House and in the administration to come up with an early test. Follow Pam Key on Twitter @pamkeyNEN",Murphy: ‘We Have No Concept of the Scope’ of Coronavirus Epidemic Because of Trump’s Failure,2020-03-08,https://www.breitbart.com/clips/2020/03/08/murphy-we-have-no-concept-of-the-scope-of-coronavirus-epidemic-because-of-trumps-failure/,Breitbart
"Former Rep. Donna Edwards (D- MD) called on President Donald Trump to “shut up” about the coronavirus outbreak. Host Chris Wallace asked, “How legitimate do you think it is for Democrats to go after the president on the administration response to the coronavirus?” Edwards said, “I think it’s legitimate to challenge the process and the management of this crisis. It is a public health crisis. I think whenever we hear Dr. Fauci and other experts to talk about this virus and about what to do, and what Americans can do, that it actually is a somewhat reassuring. ” She continued, “What we don’t get is that kind of reassurance coming directly from the president, because of his contradictions, because, you know, the information that he puts out is just not accurate. He would actually, I think, do better in terms of the public if he’d just shut up. Because I don’t think people wouldn’t necessarily blame the president for something that was out of his control, but if he continues in his administration mismanages the crisis, then I think it’s a legitimate point of challenge by anyone who wants to be president saying I would manage it better.” She added, “For example, that Hurricane Katrina and the response had with President Bush. I don’t think this is different in that respect. But the president doesn’t do himself or the American public any good when he makes assertions that are completely contrary to the scientific evidence.” Follow Pam Key on Twitter @pamkeyNEN",Donna Edwards: Trump Would Help Coronavirus Response If ‘He’d Just Shut Up’,2020-03-08,https://www.breitbart.com/clips/2020/03/08/donna-edwards-trump-would-help-coronavirus-response-if-hed-just-shut-up/,Breitbart
"Former Secretary of State Hillary Clinton, the Democratic Party’s 2016 presidential nominee, said Sunday on CNN that she “begrudgingly” gives Breitbart News “a lot of credit” for its ability to shape a narrative. Host Fareed Zakaria said, “There was an article in Vox, and I don’t know if you saw it, on Super Tuesday, on Facebook, the single most searched article —the single searched news topic was Hillary Clinton’s e-mails.” Clinton said, “I’ll tell you what I make of it, is that Fox and the sort of right-wing echo chamber has mastered Facebook, aided and abetted, might I say, by Facebook. So I read that article and what that said to me was here it’s Super Tuesday, the Democrats are trying to decide who they want to nominate against Donald Trump, the Coronavirus is spreading, we now have more and more reports from different places in the country, but led by Fox News and Breitbart and others, it’s going to be about my e-mails. A totally, you know, bogus, finished, nonsense attack on me because they know how not only to drive those stories under the radar screen where the mainstream press like yourself are covering. You know, what’s happening now, but they know how to deliver those stories through the algorithms into the feeds of millions and millions of people.” She added. “So I begrudgingly give them a lot of credit because they are shaping a narrative that is part of the messaging around Trump’s re-election, around people who challenge Trump, changing the subject all of the time.” Follow Pam Key on Twitter @pamkeyNEN",Hillary Clinton: I ‘Begrudgingly’ Give Breitbart News ‘A Lot of Credit’ for Leading the Narrative,2020-03-08,https://www.breitbart.com/clips/2020/03/08/hillary-clinton-i-begrudgingly-give-breitbart-news-a-lot-of-credit-for-leading-the-narrative/,Breitbart
"Former Vice President Joe Biden is facing backlash over his decades-long support for the North America Free Trade Agreement (NAFTA) as he campaigns across Michigan ahead of the state’s Democrat primary. Biden, who often touts his support from organized labor on the campaign trail, was met by protesters on Monday at rally in Detroit. As the former vice president was speaking, a number of individuals unfurled two giant banners, one of which read ‘NAFTA killed our jobs.’ The individuals, some of whom identified as union members, began chanting “Biden killed jobs,” forcing the former vice president to pause and address the disruption. “That’s alright, let them go,” Biden said, as supporters and security attempted to pressure the protesters to stand down. “Let them go, this is not a Trump rally. The ‘Bernie Bros’ are here, let them go.” When the crowd subsided and the protesters were escorted out, Biden used the opportunity to take a shot at both President Donald Trump and his rival for the Democrat nomination, Sen. Bernie Sanders (I-VT). “I’m not worried about it, it’s just a reflection of what’s wrong with American politics today,” the former vice president said. “This is one of the things that Donald Trump has generated, this is not who we are … as a party … or as a people. We have a lot of crazy folks around.” The altercation in Detroit comes as Biden’s long-standing support for free trade takes center stage as the primary contest heads into Michigan. Sanders, who is hoping that a win in the state can restart his flailing presidential campaign, is hammering hard on the issue. In tv ads and on the stump, the Vermont septuagenerian has lambasted Biden for his support of NAFTA and the other free trade agreements, claiming that if Democrats were to nominate someone with such a record, it would essentially mean surrendering the industrial Midwest to Republicans. “Does anybody think that Joe can go to Michigan or Wisconsin or Indiana or Minnesota and say, ‘Vote for me. I voted for those terrible trade deals,” Sanders said during a recent rally. The strategy is one that has worked in the past for the senator. During his 2016 bid for the Democrat presidential nomination, Sanders was able to score upset victories over former Secretary of State Hillary Clinton by emphasizing his opposition to free trade, specifically then-President Barack Obama’s Trans Pacific Partnership (TPP) agreement. Sanders’ message was particularly potent in Michigan, where the burden of free trade has been most pronounced. Since NAFTA was first implemented in 1994, Michigan lost more than 168,000 manufacturing jobs to countries overseas, most notably Mexico. The impact was felt most heavily by white working-class voters, many of whom lack a college degree. In 2016, such voters overwhelmingly backed Sanders in Michigan’s Democrat primary, handing the senator a narrow victory over Clinton. The results were surprising, not only because Sanders was coming off devastating losses in South Carolina and Super Tuesday, but also because most polls heading into the contest had shown the former secretary of state winning heavily. Sanders ‘victory in Michigan, along with further wins in Wisconsin and Minnesota, foreshadowed the difficulty Clinton would have in keeping such states in the Democrat column in November 2016. Biden, for his part, seems to understand that history and the detriment posed by his support for free trade. Even before the 2020 Democratic field winnowed to a head-to-head matchup with Sanders, the former vice president had already begun distancing himself from his prior stance on the topic. During a Democrat presidential debate in July 2019, Biden admitted that he would not rejoin TPP if elected president. The move was surprising given that the former vice president had once touted the deal’s ability to forge a “new world order” where open markets would force even countries such as China to reform and prosper. Biden built from that reversal at a another debate in August, when he further promised to oppose a “new NAFTA” agreement after being badgered on the issue by rivals. Monday’s protests in Detroit, though, indicate that Biden’s prior championing of free trade is unlikely to be forgotten, especially by supporters of Sanders. Complicating matters for the former vice president is that Trump, himself, appears poised to continue hammering away on the issue if Biden were to become the Democrat nominee. “Joe Biden made a deal, NAFTA,” the president said last week during a campaign rally in Scranton, Pennsylvania. “He approved it, he was pushing it. It’s the worst trade deal ever made.",Joe Biden Faces Backlash Over NAFTA Support Ahead of Michigan Primary,2020-03-09,https://www.breitbart.com/politics/2020/03/09/joe-biden-faces-backlash-over-nafta-support-ahead-of-michigan-primary/,Breitbart
"The lawyers representing the mother of a child fathered by Hunter Biden recently filed a motion seeking to have the former vice president’s son held in contempt of court for repeatedly refusing to obey a paternity and child support suit-linked order to provide financial documents, including his 2017 and 2018 personal tax returns. Citing the contempt motion filed in an Arkansas court by 28-year-old Lunden Alexis Roberts’ lawyers on Friday, the Arkansas Democrat-Gazette revealed that besides his tax returns, Hunter Biden has also failed to disclose: “All financial institutions used by him or a business he owns or controls;” “a list of all companies he currently owns or in which he has an ownership interest and the state in which those companies are incorporated;” “a list of all sources of income for the past five years;” “a list of all employers for the past five years;” tax documents for companies he owns and “a copy of deeds to properties that he owns or in which he has an ownership interest.” “[T]he defendant continues to act as though he has no respect for this Court, its orders, the legal process in this state, or the needs of his child for support,” the motion declared, adding, “This Court should take some action that will make the defendant follow court orders and a believer in the rule of law.” Roberts is a former stripper and the mother of 50-year-old Hunter’s child. Hunter’s conduct is “willful and contemptuous,” Roberts’ lawyers also argued, urging the court to order him to appear in person at a March 13 pretrial hearing to explain why the tribunal should not hold him in contempt, Fox News reported on Sunday. The Arkansas court expects Hunter to appear for a deposition on Wednesday in Little Rock despite his attorney arguing that his client would be unavailable until April 1. Hunter must appear for a deposition before the March 13 hearing, the judge insisted. “After months of hiding, one has to wonder if the reason Hunter Biden continues to defy the court is because there are financial documents could shed light on his father’s massive conflicts of interest as vice president,” Steve Guest, a spokesman for the Republican National Committee (RNC), told Fox News on Sunday. Citing the results of a DNA test, the Arkansas judge hearing the paternity and child support case ruled in January that Democrat presidential hopeful Joe Biden’s son, Hunter, is the “biological and legal father” of Roberts’ child. According to documents filed in connection to Roberts’ suit, Hunter is the subject of multiple criminal investigations, including a money-laundering probe linked to Ukrainian gas company Burisma Holdings. Hunter served on Burisma’s board of directors for a lucrative $83,000 a month while his father was in charge of U.S. policy towards Ukraine as vice president, prompting corruption allegations that have triggered investigations by Senate Republicans. The former VP’s son worked for Burisma between 2014 and 2019 despite the conflict of interest and corruption concerns raised by individuals from inside and outside the Obama administration. Hunter has repeatedly defied multiple court orders, refusing to comply with deadlines to provide the financial information. Roberts’ lawyers have reportedly filed three motions to hold Hunter in contempt of the Arkansas court — on March 6, December 23, and January 20. The Arkansas Democrat-Gazette reported on Saturday: In Friday’s Renewed Motion for Contempt and for Order to Show Cause, Roberts’ attorney, Clint Lancaster, said [Hunter] “has continued to flaunt the orders of this Court by failing to answer discovery, comply with court orders, and provide his financial information.” Circuit Judge Don McSpadden, who was initially assigned the case, made clear more than three months ago that Hunter could not withhold certain records. Circuit Judge Holly Meyer replaced McSpadden in January. “He needs to make himself available unless his hair is on fire,” Meyer declared during a conference call with the attorneys on the case last month, the Democrat-Gazette reported. According to the New York Times, Hunter is spending time pursuing a career in art in a rented $12,000-per-month hideout in the Hollywood Hills. He is reportedly driving a Porsche. Donald Trump Jr. challenged Hunter over the weekend to a debate, adding that he would release his tax returns if the former vice president’s son makes his public as well.",Contempt Motion by Mother of Hunter Biden’s Child: He ‘Willfully’ Defied Court Order to Provide Documents,2020-03-09,https://www.breitbart.com/politics/2020/03/09/contempt-motion-hunter-biden-willfully-defied-court-order/,Breitbart
"During an interview aired on Monday’s broadcast of MSNBC’s “The Last Word,” 2020 Democratic presidential candidate former Vice President Joe Biden stated President Trump has “no competence” on handling the coronavirus and that the market is falling because people don’t trust what the president says. Biden stated, “[T]his gets down to competence and capability. And the — unfortunately, the president has very — no competence in how to handle this crisis. Not that there’s any clear answer that you’re just going to make this all go away, but the idea that he shows up at the CDC and says that well, you know, this is like — everything’s just perfect, just like my call to the leader of Ukraine. I mean, people just wonder what’s going on, or he’s down there golfing today. I mean, there’s no sense of urgency.” Host Lawrence O’Donnell asked, “Do you think the market reaction is a reaction to the markets realizing the president simply does not tell them or the world or this country the truth about this situation, and a market needs clear information?” Biden responded, “I believe that’s the case. Now, it doesn’t mean the market wouldn’t still go down, but it wouldn’t collapse, I don’t think. Now, who can say? But I think there’s no confidence in the president and anything he says or does.” Follow Ian Hanchett on Twitter @IanHanchett",Biden: Lack of Trust in Trump Is Causing Market ‘Collapse’ – Trump Has ‘No Competence’ on Handling Coronavirus,2020-03-09,https://www.breitbart.com/clips/2020/03/09/biden-lack-of-trust-in-trump-is-causing-market-collapse-trump-has-no-competence-on-handling-coronavirus/,Breitbart
"During a town hall on the Fox News Channel on Monday, 2020 Democratic presidential candidate Sen. Bernie Sanders (I-VT) said that he doesn’t regret his comments about Fidel Castro and stated that China has reduced extreme poverty, but saying that doesn’t mean he approves of China’s government. Moderator Bret Baier asked, “Do you regret at all saying what you said, at that time, in this race?” Sanders responded, “No. Look, I have spent my entire life fighting for working people and fighting for democracy. And, Bret, if you check my record, I have condemned authoritarianism, whether it is in the Soviet Union, whether it’s in Cuba, whether it is in Saudi Arabia. … Whether it’s the United Arab Emirates, wherever it may be. I happen to be old-fashioned, and I believe in democracy. So, if you look at a country like China, for example, today, is China a democracy? Of course it’s not a democracy. It is an authoritarian country. And Xi is taking it in a bad direction. But what can we say about China in the last 50 years? Would anybody in their right mind deny that extreme poverty in China has been reduced? Can anyone deny that? Of course not. Does that mean we approve of the Chinese government? No, it doesn’t.” He continued, “But I think, sometimes — and I know it’s hard given — not you — given the media that we deal with and everything else, you say something, and people can beat up on you. I think you’ve got to tell the truth. So, if, in China, they have reduced extreme poverty, does that make me a communist who supports China? No. I’m just telling you a simple fact.” Follow Ian Hanchett on Twitter @IanHanchett","Sanders: I Don’t Regret Castro Comments, China Has Reduced Extreme Poverty",2020-03-09,https://www.breitbart.com/clips/2020/03/09/sanders-i-dont-regret-castro-comments-china-has-reduced-extreme-poverty/,Breitbart
"Scott Presler, the man who launched the clean up American cities movement last summer after President Donald Trump spotlighted the blight in Democrat-controlled Baltimore, continued his work over the weekend helping tornado victims in Tennessee. But he also told Breitbart News that in cities across the country, it is illegal immigrants getting benefits while homeless Americans are living on the streets. Presler told Breitbart News that he felt compelled to use his large network of volunteers to lend a hand in the cleanup effort in Tennessee following a tornado that devastated parts of the state and killed at least 25 people. “We had over 100 volunteers. The majority were from Nashville, but some even came from Knoxville, Tennessee. One drove ten hours from Dallas in her car, and some even came from Atlanta, Georgia,” Presler told Breitbart News. “We filled half of a truck full of items that we donated to a Baptist church including things like water or non-perishable food hygiene products, baby wipes,” Presler said. “And then after we were done donating the items, we sent out teams of volunteers to help clean up debris.” The real heroes, in addition to the volunteers, were Jami & her amazing team,  who donated 100 meals!  Make sure to follow @TNCobblerCo & support these good-hearted people. #NashvilleStrong pic.twitter.com/ztiAm20K1i — #ThePersistence (@ScottPresler) March 9, 2020  But what has struck Presler over the course of his mission is how illegal immigrants are being prioritized in U.S. cities while Americans are living on the streets. Presler spoke about this issue recently at the 2020 CPAC convention in Oxon Hill, Maryland. “Besides picking up trash, your heart is drawn to homeless people,” Breitbart News said in the interview. “And you don’t just pick up trash around them, but you like to engage with them. Why do you want to do that?” “I want to give them hope,” Presler said. “These are cities that I’m going to that have been neglected for decades where these people truly are hopeless.” “And so I want to go in there as just a shot of energy — a shot of this ‘can do’ attitude and ‘can do’ spirit,” Presler said. He said he met a young man living on the streets of San Francisco who had a daughter and a job, ironically, picking up trash, but lived in a tent on the streets. Presler asked him how he felt about illegal immigrants getting benefits. “And he said, ‘I’m angry.’ He said, ‘What about us? We should have priority. We were here first.’” “So, in dealing with the homeless community, especially, I’m not only really careful to respect their humanity because they are — they’re human beings,” Presler said, “but I want to change the stigma because so many people think the homeless community are lazy, which is wrong.” Presler said he met a man in Los Angeles who worked in the movie business but still lived on the streets. “These are people that either they [face] hard times or they can’t afford housing, but these are smart, intellectual people, and I just think it’s wrong that illegal immigrants come first but we don’t take care of our people,” Presler said. Presler plans more cleanups on March 14 in Pittsburgh and in Philadelphia on April 4. His crew will visit Detroit on May 2, and he also hopes to host a cleanup during the Democrat nominating conference in July in Milwaukee, Wisconsin. Follow Penny Starr on Twitter.","Scott Presler of Clean Up American Cities Movement: Homeless Americans, Not Illegal Aliens, Should Be Priority",2020-03-09,https://www.breitbart.com/politics/2020/03/09/scott-presler-homeless-americans-not-illegal-immigrants-should-be-priority/,Breitbart
"Lenard “Charlamagne tha God” McKelvey criticized former Vice President Joe Biden on Monday for not appearing on The Breakfast Club radio broadcast. McKelvey told MSNBC’s Craig Melvin that the Democrat frontrunner owes his “political life” to black supporters and that his campaign “would be dead” without them. And while Vermont Sen. Bernie Sanders, Massachusetts Sen. Elizabeth Warren, California Sen. Kamala Harris, and former Mayor Pete Buttigieg have all appeared to speak to black voters through his nationally syndicated radio show, Biden has been conspicuously absent. Asked why he thinks that might be, McKelvey was stumped: “I have no idea,” he answered. “It goes back to what I said: Joe Biden owes black people his political life. You know what I’m saying? So don’t disrespect that base by not showing up, especially when, you know, all your other former opponents did,” he said. McKelvey also claimed that sources have told him that the decision may have something to do with Biden’s campaign advisers. “I definitely got it on great authority that a lot of the black surrogates around him don’t want him to come on ‘The Breakfast Club’ for whatever reason,” he said. “Black people saved his life the past couple of weeks,” McKelvey concluded. “His campaign would be dead if it wasn’t for our O.G. Jim Clyburn in South Carolina endorsing him, and all those black voters in the South going out and voting for him,” McKelvey concluded. “Plus, you were the vice president for the first black president. You, in particular, definitely need a black agenda.”",‘Charlamagne tha God’ Blasts Joe Biden for Not Appearing on Radio Show,2020-03-09,https://www.breitbart.com/politics/2020/03/09/charlamagne-tha-god-blasts-joe-biden-for-not-appearing-on-radio-show/,Breitbart
