article_text,article_title,date,link,publisher
"President Donald Trump has fortified his White House with a new chief of staff, former House Freedom Caucus chairman and retiring Rep. Mark Meadows (R-NC). On Friday night, the president named Meadows his new incoming White House chief of staff, announcing that his acting chief of staff Mick Mulvaney would become the new special envoy to Northern Ireland. I am pleased to announce that Congressman Mark Meadows will become White House Chief of Staff. I have long known and worked with Mark, and the relationship is a very good one…. — Donald J. Trump (@realDonaldTrump) March 7, 2020  ….I want to thank Acting Chief Mick Mulvaney for having served the Administration so well. He will become the United States Special Envoy for Northern Ireland. Thank you! — Donald J. Trump (@realDonaldTrump) March 7, 2020  Meadows served as the second chairman of the House Freedom Caucus, taking the reins from the group’s founder and his close ally, Rep. Jim Jordan (R-OH). Together, Meadows and Jordan have been a pair of the president’s fiercest defenders in the House, but even before President Trump’s 2016 election, the soft-spoken firebrand conservative from western North Carolina has helped pave the future path of the Republican Party—pulling the GOP away from swamp deals and failed establishment politics towards populist, grassroots conservative policies that are much more popular with the electorate. Meadows’ success in Congress has won him many friends among top conservatives and even across the aisle, with a huge swath of Trump allies on Friday evening telling Breitbart News that the president could not have made a better choice going into his re-election campaign. “Congressman Meadows has been one of the most effective advocates for the MAGA movement for years now,” Donald Trump, Jr., President Trump’s eldest son, told Breitbart News. “There are some major battles ahead and I can’t think of anyone more equipped to fight alongside the President for the future of our country.” “Meadows is cut from the same cloth as the President; he’s a fighter and will do what it takes to win,” Cliff Sims, a former Trump White House official and outside ally of the president, added. “He’s the perfect choice to lead the White House staff through election season. A brilliant choice by President Trump.” “Mark has great political instincts and, to put it bluntly, is just a total killer,” Andy Surabian, a GOP strategist and also a former White House official, added. “He’s exactly who President Trump needs by his side in an election year.” “Mark being chief of staff is a massive win for the MAGA movement,” Charlie Kirk, the founder and president of Turning Point USA, told Breitbart News. “Mark Meadows is the right person at the right time to serve as President Trump’s Chief of Staff,” Rep. Louie Gohmert (R-TX) told Breitbart News as well. “After enduring Establishment operatives undermining his efforts since his inauguration, the President will now have a fearless warrior on the inside to promote and safeguard his agenda.” Meadows was a back-bencher second-term congressman when he filed a “motion to vacate the chair” in the summer of 2015, a bold move that would have forced a vote on whether then-Speaker John Boehner would be allowed to remain in his position. When Meadows did it, most of the Washington establishment wrote him off and considered the effort unserious, but quickly and quietly he—working with his fellow House Freedom Caucus members—amassed the votes necessary by September 2015 to knock out Boehner. When Boehner realized Meadows had succeeded, he resigned before a public spectacle tanked him on the floor of the House in order to avoid embarrassment. While most of the rest of the media ignored him, Breitbart News traveled to his district that August recess to profile him and provide a detailed report on his then-quixotic effort to change Congress for the better by removing someone who, as Speaker, had pushed a variety of deals with now former President Barack Obama that left the country worse off. In the interview he gave during that trip to his district in western North Carolina, Meadows explained how so many people come to Washington, DC, and forget why they were elected in the first place—but how he wanted to be different. “I think everybody starts out doing that, because they’re real sensitive to the fact that they just got into office and say, ‘Golly, I want to be a voice for the people,’” Meadows said when asked if enough members of Congress listen to their constituents. “The longer they’re there, the less likely you are to listen. For me, I’ve had to redouble my effort and not say, okay, pay attention to what are the priorities in Washington, D.C., but really try to listen to what are the priorities here? There are some of them that have been difficult for me. A prime example is on the Syrian invasion, where really they were bantering back and forth on should we invade Syria or not? I had my own personal view, the fact I believed that ISIS was going to continue to grow and that we had to go in and put an end to it right away, really quickly. I was war weary, but I felt like we needed to do that. My district started calling the office and sending in surveys and other things as well—87 percent of the people that contacted us, or it could have been 82 – 82 or 87 percent of the people said, ‘We don’t want you to do that.’ We’re tired of wars. It shifted where we were to saying, “Just listen, the people back home…” and it wasn’t just Republicans. It was Democrats, independents, everyone. For us, it’s just about trying to have an open ea, then going to Washington, D.C., and voting the way the people here want you to vote. When you do that, it sometimes puts you at odds with what is deemed pragmatic in Washington, D.C., or ‘the practical thing to do,’ but I try to conduct at least a couple days of really listening every time I come back – especially if it’s for a week or longer where I’m just listening to people. Both the good and the bad. We’re going to continue to try to get better,” Meadows said. Listen to his constituents he certainly did. After he toppled Boehner—a remarkable achievement for a then-second-term congressman—Meadows soon after became the chairman of the House Freedom Caucus, replacing its first chairman and founder Jim Jordan. Meadows weaponized the Freedom Caucus, leveraging the group’s approximately 40 members in the GOP majority for the last year plus of Obama’s administration and for the first two years of Trump’s first term to steer the party away from now former Speaker Paul Ryan’s failed visions for Republicans and to guide the party toward successes on major issues ranging from taxes to healthcare to immigration. Supporters of Meadows say that they should expect Trump’s new chief of staff to continue to listen to the constituents who put both of them in office—rather than special interests or lobbyists. “Finally, a chief of staff that respects the Trump supporters who put him in the White House,” J. Christian Adams, president of the Public Interest Legal Foundation, told Breitbart News. Many members of Meadows’ Freedom Caucus unit have gone on to much bigger and better things. Of course, Mulvaney is the outgoing acting White House chief of staff, a position he took after previously serving as director of Office of Management and Budget (OMB) under Trump. But he was one of Meadows’s allies and fellow Freedom Caucus fighters back in the early days for both of them. Florida Gov. Ron DeSantis, a Republican who’s currently America’s most popular governor, was a Freedom Caucus member when he served in the House. Former Rep. Cynthia Lummis (R-WY), now the frontrunner for U.S. Senate in Wyoming, was a Freedom Caucus member too. Another former Freedom Caucus member, former Rep. Dave Brat (R-VA), now works at Liberty University leading efforts to expose Chinese communists. He told Breitbart News on Friday night that Meadows is an excellent choice for Trump to lead the White House staff. “I think Meadows loves the American people as President Trump does and that he is highly ethical and he knows who the bad apples are, and he will help to execute President Trump’s agenda and make America great again,” Brat said. When Ryan was pushing President Trump to support an unpopular and unsuccessful healthcare plan at the beginning of his first term—an Obamacare replacement that critics derisively called “RyanCare”—the deal fell apart, a Ryan failure that hurt Trump in his first few months as president. Meadows, working with Republican members like now former Rep. Tom MacArthur (R-NJ), revived, reformed, strengthened, and secured House passage of the GOP healthcare plan. It was later doomed in the Senate by the late Sen. John McCain (R-AZ), who infamously gave it a thumbs-down on the floor of the Senate as he voted against it. But it would have stopped in the House after Ryan’s failure had it not been for Meadows’ work to save the president’s push for a better healthcare vision for the country than Obamacare. Healthcare was not the only major policy fight in which Meadows helped President Trump against leftist Democrats and establishment Republicans. On everything from ending endless wars to fighting against open borders amnesty pushes to battling for the Trump tax cuts and more, Meadows has been one of Trump’s go-to allies in the House since the president took office—and the two speak on the regular. Meadows was also critical in helping Trump fight back one of the most vicious and unhinged conspiracies against a sitting president in history, which ultimately ended in the president’s acquittal by the U.S. Senate after the Democrat-led House impeached him. A member of the president’s team of House members fighting back against the coup attempt by the deep state, Meadows was critical in securing the president’s position and holding back the plotters. The coup attempt started out with various leftist and media attacks claiming Russian “collusion” with Trump’s 2016 campaign that eventually led to the Special Counsel Robert Mueller’s investigation that cleared Trump in the en, which then led to the renewed attacks on the Ukraine front. The Ukiraine accusations led to the House impeachment effort and, finally, the president’s acquittal. Every step of the way, Meadows was at Trump’s side, fighting back against the leftists and fake news attacks that ended up failing to take Trump down. For all of these reasons and more, Meadows has lots of allies in the conservative movemen. FreedomWorks Vice President Noah Wall told Breitbart News that his group could not be happier with the choice Trump made here. “FreedomWorks could not be more proud that the former House Freedom Caucus chair and strong constitutional conservative will help support President Trump through this critical election year,” Wall said. Rick Manning, the president of Americans for Limited Government, added that “Mick Mulvaney did a great job of leading the White House through impeachment and has proven to be an extraordinary utility man for the President as OMB Director and the head of the CFPB.” “He will be a trusted problem solver who is able to help Northern Ireland transition through the difficulties of Brexit,” Manning said. But Meadows, Manning added, is “a fighter who has the President’s trust.”",‘The Perfect Choice’: Trump Brings Warrior Mark Meadows into White House as Election Year Chief of Staff,2020-03-06,https://www.breitbart.com/politics/2020/03/06/the-perfect-choice-trump-brings-warrior-mark-meadows-into-white-house-as-election-year-chief-of-staff/,Breitbart
"Ammunition sales are surging amid fears of pandemic-induced lawlessness and disorder as the coronavirus threatens the United States. PR Newswire reports online ammunition retailer Ammo.com has seen a 410 percent increased in .40 caliber handgun ammo sales since February 23, 2020. They have seen a 194 percent increase in .223 (AR-15 amm0) sales, 101 percent increase in 9mm ammo sales, and a 95 percent increase in the sale of 12 gauge shells. The sales of other calibers and types of ammunition have increased as well. On February 28, 2020, the Washington Examiner reported that “preppers” were buying up rifles and pistols and seeking safe havens where they could hide out should a pandemic strike. Hyatt Guns’ Justin Anderson spoke to the spike in ammunition and firearm sales, saying, “I’ve seen a notable spike in the purchase of bulk ammo, which is usually a barometer of people’s fear in these types of situations.” He added, “The person with the most ammo wins.” AWR Hawkins is an award-winning Second Amendment columnist for Breitbart News and the writer/curator of Down Range with AWR Hawkins, a weekly newsletter focused on all things Second Amendment, also for Breitbart News. He is the political analyst for Armed American Radio. Follow him on Twitter: @AWRHawkins. Reach him directly at awrhawkins@breitbart.com. Sign up to get Down Range at breitbart.com/downrange.",Ammo Sales Surge amid Fears of Pandemic-Induced Chaos,2020-03-06,https://www.breitbart.com/2nd-amendment/2020/03/06/ammo-sales-surge-pandemic-chaos/,Breitbart
"Democrat voters must determine if Joe Biden is “mentally fit” to serve as President of the United States given the former vice president’s frequently slurred speech and regular misstatements, assessed Breitbart News Senior Editor-at-Large Joel Pollak in a Wednesday interview on 55KRC with host Brian Thomas. Biden’s Super Tuesday performance — winning 566 delegates relative to Sen. Bernie Sanders’ (I-VT) 501 delegates — is not the result of a strengthening campaign but of a division among Democrat primary voter support between Sanders and Sen. Elizabeth Warren (D-MA), determined Pollak. Pollak then highlighted questions of Biden’s cognition given the former vice president’s behavior: Biden doesn’t look to be any stronger a candidate than he was throughout this campaign. On the stage last night — I was at his victory party in Los Angeles — he, at one moment, appeared to confuse his wife and his sister. He slurred his speech. He didn’t seem sharper or any better than he has been the entire campaign. “He did remember the Declaration of Independence, but I believe he was reading it off a teleprompter,” noted Pollak, referring to Biden’s failure to recall the best-known clause of one of America’s founding documents. Pollak continued: I’m being serious, here. I’m not trying to be mean. The question facing voters in the fall is going to be whether Joe Biden — should he become the nominee — is mentally fit to serve in the office, and the Democratic Party may choose a vice presidential nominee very carefully with that in mind, but it does show you that Democrats are not going to roll over in 2020. They’re going to do whatever it takes to be competitive. Pollak added, “Biden is simply not seeming to be up to the job. When you put [Trump and Biden] side-by-side on stage, Biden comes out very poorly, and I don’t think there’s very much Democrats can do to change that.” Thomas highlighted Biden’s “cognitive function” and ability “to be sharp and quick on his feet” as noticeably lacking. Thomas asked if Sanders’ supporters would go with a possible Democrat nomination of Biden as the party’s presidential nominee. “Initially my feeling was that [Sanders supporters] would sit it out. They did not like Biden. They really didn’t like Pete Buttigieg. They  don’t like Elizabeth Warren. Early surveys suggested that the Sanders voters were the least likely to stick with the party nominee. “ What we do know is that right now the Bernie Sanders camp feels that they’re the victims of a coup,” Pollak added, noting Marianne Williamson use of the term. “They feel the Democratic establishment has maneuvered once again to try to steal the election from them, and they’re fighting that.” Pollak stated, “It’s very clear — if it wasn’t before — the Democratic establishment is pulling a lot of strings behind the scenes and really, they’re barely even trying to hide it anymore. You’re going to see a lot more shouting before all this is done.” Thomas praised Breitbart News as a “great site.” “I rely on your site regularly,” he said. “I encourage my listeners to bookmark it. You’re a thorn in the side of a left-wing media and it’s a refreshing. It’s always reliable information, much to the chagrin of what leftists say about Breitbart. It’s very accurate information,and I’m pleased you’re there.” Follow Robert Kraychik on Twitter.",Pollak: Question on Biden Is if He Is ‘Mentally Fit’ to Serve as POTUS,2020-03-06,https://www.breitbart.com/2020-election/2020/03/06/pollak-question-on-biden-is-if-he-is-mentally-fit-to-serve-as-potus/,Breitbart
"On Friday, Pennsylvania Gov. Tom Wolf signed a disaster declaration to provide increased support to state agencies in combating the coronavirus. As the “COVID-19” pandemic — commonly known as coronavirus — continues its international tour, more and more cases are popping up despite a notable lack of widespread testing. Now, with two cases in eastern Pennsylvania’s Wayne and Delaware counties, Gov. Tom Wolf is taking measures to ensure his state is ready for the inevitable. “It is critical to prepare for and respond to suspected or confirmed cases in the commonwealth, and to implement measures to mitigate the spread of COVID-19,” Wolf said in a press conference immediately following his signing of an emergency disaster declaration. He continued: The disaster declaration is an additional way we can be prepared, so I authorized the Pennsylvania Emergency Management Agency Director or his designee, to assume command and control of all statewide emergency operations and authorize and direct that all commonwealth departments and agencies use all available resources and personnel as is deemed necessary to cope with this emergency situation. But his reassurance was accompanied by some street-level advice to help combat the spread of the deadly contagion. “First and foremost, we want all Pennsylvanians to be safe and remain healthy and follow the practical advice of the Department of Health on ways to protect yourself from any virus,” Wolf said, “and that’s by washing hands, covering your mouth and nose when you sneeze or cough and staying home if you are sick.” Secretary of Health Dr. Rachel Levine added her voice to the press conference as well. “As this situation evolves, we will continually update Pennsylvanians through our website, health.pa.gov, our Facebook page and our Twitter account,” she said, but she reminded citizens that “it’s important to remember that the most accurate and timely information regarding this outbreak is available through the Department of Health.” There are currently over 101,000 confirmed cases of coronavirus, though the actual number of those infected may be exponentially higher. It has officially claimed at least 3,460 lives at the time of this writing. In that light, President Donald Trump has signed an emergency $8.3 billion spending bill in the interest of protecting the American people. “It’s an unforeseen problem … came out of nowhere, but we’re taking care of it,” he said.",Pennsylvania Gov. Tom Wolf Signs Coronavirus Disaster Declaration,2020-03-06,https://www.breitbart.com/politics/2020/03/06/pennsylvania-gov-tom-wolf-signs-coronavirus-disaster-declaration/,Breitbart
"After three years of fighting childhood leukemia, Jonathan Whetstone rung the victory bell at Columbia hospital on Thursday. Since he was just two years old, Jonathan Whetstone has been fighting for his survival. When he contracted an ear infection and the flu before his second birthday, doctors said they had nothing to worry about. But as his parents watched their infant son’s energy decline, they pursued further testing. That diligence saved his life. Jonathan had been living with undetected childhood leukemia, which can carry a mortality rate as high as 40 percent. The fight for his life lasted for the next three years and finally ended on Thursday morning. “It’s kind of surreal after three years of going through this it’s finally over,” said Maryann Whetstone, Jonathan’s mother. Mark Whetstone, Jonathan’s father, has been overwhelmed by the widespread show of support. “It’s been prayers across the country,” he says, “Even outside the United States. The support we’ve gotten from our churches, families and volunteer firefighters service has been great.” But the local community has been just as fervent. The Edisto and Bolentown Volunteer Fire Department, where Mark volunteers, lent their support to the Whetstone family — and shared in their celebration. “What a Beautiful Day! Jonathan Whetstone has officially BEAT CANCER and rung the bell,” they posted on Facebook on Thursday morning.  But, as they wrote, “our fight still continues.” To that end, the department has signed up to participate in the “7th Annual Curing Kids Cancer Fire Truck Pull,” an event that raises money to fund research for a cure that would save the lives of other children just like Jonathan. “There are many more kids out there that need your help,” they wrote. “Help us continue celebrating Jonathan by donating to the link below. Even the smallest donation can make a HUGE difference.” At the time of this writing, they have raised $9,215 of their $10,000 goal.",South Carolina 5-Year-Old Rings Cancer-Free Bell After 3-Year Battle,2020-03-06,https://www.breitbart.com/politics/2020/03/06/south-carolina-5-year-old-rings-cancer-free-bell-after-3-year-battle/,Breitbart
"During a portion of an interview with CNN’s Fareed Zakaria released on Friday, former Democratic presidential candidate Hillary Clinton reiterated her claim that 2020 Democratic presidential candidate Sen. Bernie Sanders (I-VT) isn’t the strongest person to take on President Trump and stated that 2020 Democrat former Vice President Joe Biden is building “a broad-based coalition.” Clinton said, “As I’ve said many times, I do not think he’s our strongest nominee against Donald Trump.” Zakaria then asked if this was an endorsement of Biden, and Clinton responded that she isn’t endorsing. Zakaria then countered, “There’s nobody left.” Clinton conceded that there isn’t anyone left, adding, “But I think what Joe’s victories on Super Tuesday showed is that he is building the kind of coalition that I had, basically. It’s a broad-based coalition. I finished most of the work I needed to do for the nomination on Super Tuesday, and then it kind of lingered on. And I think Joe is on track to doing exactly the same thing, putting together a coalition of voters who are energized.” Follow Ian Hanchett on Twitter @IanHanchett",Hillary Clinton: Biden Building ‘Broad-Based Coalition’ – Sanders Not ‘Our Strongest Nominee’,2020-03-06,https://www.breitbart.com/clips/2020/03/06/hillary-clinton-biden-building-broad-based-coalition-sanders-not-our-strongest-nominee/,Breitbart
"The Person County Sheriff’s Office fulfilled 100-year-old Ruth Bryant’s birthday wish on Tuesday with a tongue-in-cheek “arrest.” By the time you have reached a full century of life, you have, statistically speaking, experienced more than most people ever will. But for Ruth Bryant of Person, North Carolina, there is still more to do. Specifically, the otherwise well-behaved elderly woman wanted to experience being arrested. With the help of officers from the county sheriff’s office, she got her wish. Deputies R.D. Weaver and Tevin Dixon served a warrant for Bryant’s arrest, charging her with “indecent exposure” in the midst of her birthday celebration. Bryant was cuffed to her walker as she grumbled and complained, telling officers they were “getting on my last nerve.” Bryant was transported from her home at the assisted living facility to the county jail. Officers pulled out all the stops, even taking her “mug shot.” But upon arrival, she had some advice for Dixon on who he should go after next. “Who’s that?” Dixon asked. “The people who make these low damn seats in all these cars,” Bryant said. “You ought to arrest every one of them.”",North Carolina Centenarian Gets ‘Arrested’ for Bucket List,2020-03-06,https://www.breitbart.com/politics/2020/03/06/nc-centenarian-arrested-bucket-list/,Breitbart
