article_text,article_title,date,link,publisher
"Rep. Alexandria Ocasio-Cortez (D-NY) proclaimed on Friday that Sen. Bernie Sanders (I-VT) is “much, much stronger” than Joe Biden (D) with independent voters. “Bernie’s strong record on trade, his exemplary performance with Latino voters, and his overwhelming support among folks making <$40k make him a stronger electoral college candidate,” Ocasio-Cortez posted alongside a clip of her recent appearance with CNN’s Chris Cuomo. “He can put key Southwest states in play and is stronger in the industrial Midwest against Trump,” she continued before declaring that Sanders, a self-described socialist, will appeal to independent voters with greater ease than Biden. “.@BernieSanders is also much, much stronger with independent voters who we will need in November,” she said. “He is a stronger candidate than Biden against Trump. I’m not just saying that because we align on progressive policy. I’m saying it because I believe it is true”: .@BernieSanders is also much, much stronger with independent voters who we will need in November. He is a stronger candidate than Biden against Trump. I’m not just saying that because we align on progressive policy. I’m saying it because I believe it is true. — Alexandria Ocasio-Cortez (@AOC) March 6, 2020  A Morning Consult poll, taken after Super Tuesday, shows that a majority of potential Democrat primary voters, 51 percent, view Biden as having the best chance of defeating President Trump in November. Only 28 percent chose Sanders. The Sanders surrogate, Ocasio-Cortez, has already signaled she will back Biden if he wins the Democrat nomination. “I’ve said throughout this entire process that what is so important is that we ultimately unite behind whoever that Democratic nominee is,” she stated during a Thursday appearance on NBC’s Late Night with Seth Meyers. “I think it’s a two-way street.”",Alexandria Ocasio-Cortez: Bernie Sanders ‘Much Stronger’ than Joe Biden with Independents,2020-03-07,https://www.breitbart.com/politics/2020/03/07/alexandria-ocasio-cortez-bernie-sanders-much-stronger-joe-biden-independents/,Breitbart
"Joe Biden (D) is holding a slight edge over Sen. Bernie Sanders (I-VT) in Missouri ahead of the state’s March 10 primary, an Emerson College/Nexstar Media poll released this week showed. Biden and Sanders will battle in six states — Idaho, Michigan, Mississippi, Missouri, North Dakota, Washington — on Tuesday. According to an Emerson poll, taken March 4-5, 2020, among 425 of likely Democrat primary voters in Missouri, the former vice president holds a four-point edge over Sanders, just days ahead of the primaries. He leads Sanders 48 percent to 44 percent. Rep. Tulsi Gabbard (D-HI) who remains in the race, garnered two percent support. The margin of error of +/- 4.7 percent puts Biden’s lead within the margin of error: #Missouri @EmersonPolling/@NXSTMediaGroup Poll (3/4-5):Biden 48%Sanders 44%Gabbard 2%https://t.co/IYJUGizYXu — Political Polls (@Politics_Polls) March 5, 2020  Emerson reports: The poll was conducted before Senator Elizabeth Warren had dropped out of the Presidential race on Thursday, however, Warren supporters were asked who their second choice candidates are. A majority, 53%, said that Sanders was their second choice, followed by 32% who said Biden was their second choice, 5% who chose Gabbard, and 10% who were undecided as to who their second choice candidate will be. Despite Biden’s edge, the greatest proportion of likely Democrat voters, 43 percent, are supportive of Medicare for All — a hallmark of Sanders’ campaign. “When asked which candidate had the best healthcare policy, Sanders lead with 43% and Biden followed at 40%,” Emerson reported. While Missouri does not offer the most delegates on Tuesday — that goes to Michigan, which has 125 delegates up for grabs — 68 delegates are at stake.",Missouri Poll: Joe Biden Holds Edge over Bernie Sanders,2020-03-07,https://www.breitbart.com/politics/2020/03/07/missouri-poll-joe-biden-holds-edge-over-bernie-sanders/,Breitbart
"Swedish populist leader Jimmie Åkesson has been reported to the police for inciting “hate” after handing out “Sweden is full” flyers in Turkey this week. Swedish attorney Behrang Eslami reported the Sweden Democrat (SD) leader to the police, claiming that Åkesson was engaging in incitement against a group of people by handing out the flyers near Turkey’s border with Greece. “I believe that it is everyone’s right to seek asylum in Europe or in Sweden,” Elsami told Swedish newspaper Aftonbladet. “To go down and try to persuade people, who are fleeing for their lives and in need, not to go to Europe. It is in principle wrong and it violates human rights,” he claimed. Åkesson responded to the police report, telling broadcaster TV4, in comments reported by Nyheter Idag, that he considered himself a voice for many Swedes, pointing to recent opinion polls that have shown his party as the most popular in the country. Swedish Populist Leader Hands Out ‘Sweden Is Full’ Flyers in Turkey https://t.co/kYSdYhi75L — Breitbart London (@BreitbartLondon) March 5, 2020  “I think it is pretty clear when you look at opinion polls and other things that the Swedish people want a more restrictive immigration policy than the one we have had so far,” he said. Lawyer Anton Strand, who was hired by Åkesson, also dismissed the police complaint, telling Nyheter Idag: “It seems to me that people have sought attention rather than wanted to make a serious complaint.” “Notifying a person without basis can in itself constitute a criminal act and my client is also considering reporting the lawyer to the Law Society,” he added. Åkesson’s handing out of the flyers, which stated, “Sweden is full. Don’t come to us! We can’t give you more money or provide housing. Sorry about this message,” is not the first time a country or politicians have tried to dissuade migrants from coming to Europe. In 2018, Belgium launched a social media campaign directed at migrants, stating that many of the promises made by people-traffickers about Europe were actually myths. PICTURES: Greek Border in Flames as Migrants Keep Trying to Break Through https://t.co/DTFBEmxdTc — Breitbart London (@BreitbartLondon) March 7, 2020 ",Swedish Populist Leader Reported to Police for Handing Out ‘Sweden Is Full’ Flyers,2020-03-07,https://www.breitbart.com/europe/2020/03/07/swedish-populist-leader-reported-to-police-for-handing-out-sweden-is-full-flyers/,Breitbart
"Rep. Rashida Tlaib (D-MI) stumped for Sen. Bernie Sanders (I-VT) at a rally in Detroit, Michigan, on Friday, encouraging supporters to mobilize their friends and family and declaring that it would “feel good to have a president that you didn’t have to check” all the time. Tlaib stumped for the presidential hopeful on Friday in her home state ahead of its upcoming March 10 primary. “This is a once in a lifetime moment in our country to elect someone who won’t sell us out,” she said to cheers. “It would feel good to have a president that you didn’t have to check him all the time,” she continued, instructing the energized crowd to mobilize their friends and family members: 2020 is about showing up for others folks. It really is, because when you cast that vote, please know that vote isn’t just for you. It’s for the kids— kids caged at the border. It’s for that mother that doesn’t know how she can afford insulin for her daughter, for her children. “It’s for all of the people now living in poverty. It’s for my neighbors right here in Detroit that get their water shut off, their kids taken away the following day. Show up for her,” she continued. Tlaib praised Sanders for taking on the “wealthy” and “powerful” and predicted that he will win Michigan. “He’s winning states all over the country, and he’s about to win Michigan,” she said, promising that “another world is possible.” Sanders, for his part, delivered a typical stump speech, calling President Trump a “pathological liar,” “bully,” and “vindictive person.” He also accused him of running a “corrupt administration”:  Michigan, offering 125 delegates, is one of six states voting Tuesday.",Rashida Tlaib: ‘It Would Feel Good to Have a President that You Didn’t Have to Check’ All the Time,2020-03-07,https://www.breitbart.com/politics/2020/03/07/rashida-tlaib-feel-good-have-president-didnt-have-check-all-time/,Breitbart
"MSNBC anchor Chris Hayes criticized President Donald Trump’s response to the coronavirus outbreak during his Friday broadcast. Hayes said, “Consider this: how does anyone–you, me, Vice President Pence–know how to handle a situation if we don’t know the full scope? We have had three months to prepare for the coronavirus to come to the U.S. and see how outbreaks started. We have completely failed. The federal government have completely failed until now. We are weeks and weeks behind where we should be.” After comparing the coronavirus outbreak to Chernobyl and Hurricane Maria, Hayes played a clip of Trump being asked about a cruise ship docked off the California coast with coronavirus patients. Trump said, “I’d rather have the people stay, but I’d go with them. I told them to make the final decision. I would rather — because I like the numbers being where they are, I don’t need to have the numbers double because of one ship … I would rather have the numbers stay where they are. But if they want to take them off, they’ll take them off.” Hayes said, “He’s saying that his preference, in defiance of the experts, is that the sick Americans stay marooned on the boat because he doesn’t want the numbers going up for him… All he cares about at the numbers, not the actual problem.” He concluded, “You cannot spin a virus. Countries like China learned that early on. Spinning is all our president knows. This is what happens when you elect a BS artist to the most important job in the country. He has BSed his way through his entire career. He has BSed his way through a crisis, and he is trying to BS his way through this one so here we are.” Follow Pam Key on Twitter @pamkeyNEN",MSNBC’s Hayes: ‘BS Artist’ Trump Coronavirus Response ‘Completely Failed’,2020-03-06,https://www.breitbart.com/clips/2020/03/06/msnbcs-hayes-bs-artist-trump-coronavirus-response-completely-failed/,Breitbart
"Democrat voters must determine if Joe Biden is “mentally fit” to serve as President of the United States given the former vice president’s frequently slurred speech and regular misstatements, assessed Breitbart News Senior Editor-at-Large Joel Pollak in a Wednesday interview on 55KRC with host Brian Thomas. Biden’s Super Tuesday performance — winning 566 delegates relative to Sen. Bernie Sanders’ (I-VT) 501 delegates — is not the result of a strengthening campaign but of a division among Democrat primary voter support between Sanders and Sen. Elizabeth Warren (D-MA), determined Pollak. Pollak then highlighted questions of Biden’s cognition given the former vice president’s behavior: Biden doesn’t look to be any stronger a candidate than he was throughout this campaign. On the stage last night — I was at his victory party in Los Angeles — he, at one moment, appeared to confuse his wife and his sister. He slurred his speech. He didn’t seem sharper or any better than he has been the entire campaign. “He did remember the Declaration of Independence, but I believe he was reading it off a teleprompter,” noted Pollak, referring to Biden’s failure to recall the best-known clause of one of America’s founding documents. Pollak continued: I’m being serious, here. I’m not trying to be mean. The question facing voters in the fall is going to be whether Joe Biden — should he become the nominee — is mentally fit to serve in the office, and the Democratic Party may choose a vice presidential nominee very carefully with that in mind, but it does show you that Democrats are not going to roll over in 2020. They’re going to do whatever it takes to be competitive. Pollak added, “Biden is simply not seeming to be up to the job. When you put [Trump and Biden] side-by-side on stage, Biden comes out very poorly, and I don’t think there’s very much Democrats can do to change that.” Thomas highlighted Biden’s “cognitive function” and ability “to be sharp and quick on his feet” as noticeably lacking. Thomas asked if Sanders’ supporters would go with a possible Democrat nomination of Biden as the party’s presidential nominee. “Initially my feeling was that [Sanders supporters] would sit it out. They did not like Biden. They really didn’t like Pete Buttigieg. They  don’t like Elizabeth Warren. Early surveys suggested that the Sanders voters were the least likely to stick with the party nominee. “ What we do know is that right now the Bernie Sanders camp feels that they’re the victims of a coup,” Pollak added, noting Marianne Williamson use of the term. “They feel the Democratic establishment has maneuvered once again to try to steal the election from them, and they’re fighting that.” Pollak stated, “It’s very clear — if it wasn’t before — the Democratic establishment is pulling a lot of strings behind the scenes and really, they’re barely even trying to hide it anymore. You’re going to see a lot more shouting before all this is done.” Thomas praised Breitbart News as a “great site.” “I rely on your site regularly,” he said. “I encourage my listeners to bookmark it. You’re a thorn in the side of a left-wing media and it’s refreshing. It’s always reliable information, much to the chagrin of what leftists say about Breitbart. It’s very accurate information, and I’m pleased you’re there.” The Brian Thomas Show, which broadcasts live on AM station 55KRC in Cincinnati from 5:00 a.m. to 9:00 a.m. Eastern, is available any time nationwide via iHeartRADIO. Follow Robert Kraychik on Twitter.",Pollak: Question on Biden Is if He Is ‘Mentally Fit’ to Serve as POTUS,2020-03-06,https://www.breitbart.com/2020-election/2020/03/06/pollak-question-on-biden-is-if-he-is-mentally-fit-to-serve-as-potus/,Breitbart
"The American Conservative Union (ACU) announced Saturday evening that one attendee at last month’s Conservative Political Action Conference (CPAC) had tested positive for coronavirus earlier that day. The individual in question had been exposed to coronavirus before the conference, the ACU said, and did not interact with President Donald Trump or Vice President Mike Pence “and never attended events in the main hall.” The announcement was celebrated by social media trolls, who delighted in the idea that people who support the president might have become ill as the administration has defended its approach to managing the coronavirus. Important Health Notification for CPAC 2020 participants and attendees. pic.twitter.com/NtahNO8st3 — ACU (@ACUConservative) March 7, 2020  That prompted one New York Times reporter to admonish the Twitter trolls not to “become what you hate”: Dear people celebrating an illness on here: CPAC is held in one of the DC area’s biggest convention venues. Many people work and attend events including kids, older people, reporters, waitstaff, janitorial crew. Please don’t become what you hate. — Elizabeth Williamson (@NYTLiz) March 7, 2020  The White House responded a statement indicating that “every precaution” was being taken: White House @PressSec to @RealClearNews: “White House is aware of an individual testing positive for coronavirus after attending the CPAC conference that took place nearly two weeks ago.” pic.twitter.com/KGgVU4LP2P — Philip Wegmann (@PhilipWegmann) March 8, 2020  Separately on Saturday, the District of Columbia confirmed its first case of coronavirus. Politico reported that the individual in question was not the same as the person who attended CPAC, who is being quarantined in New Jersey. Joel B. Pollak is Senior Editor-at-Large at Breitbart News and the host of Breitbart News Sunday on Sirius XM Patriot on Sunday evenings from 7 p.m. to 10 p.m. ET (4 p.m. to 7 p.m. PT). He earned an A.B. in Social Studies and Environmental Science and Public Policy from Harvard College, and a J.D. from Harvard Law School. He is a winner of the 2018 Robert Novak Journalism Alumni Fellowship. He is also the co-author of How Trump Won: The Inside Story of a Revolution, which is available from Regnery. Follow him on Twitter at @joelpollak.",ACU: CPAC Attendee Tested Positive for Coronavirus,2020-03-07,https://www.breitbart.com/politics/2020/03/07/acu-cpac-attendee-tested-positive-for-coronavirus/,Breitbart
